"字段1","字段4","字段5"
"星夜行","13089","一旦尺度放开，我国的影视作品还是比一向黑政府的韩国电影牛的，毕竟中国式的打官腔和厚黑学，是外国人学不来的。"
"大物电路都有毒","11947","看的时候觉得国家真黑暗，可是转念一想，这些黑暗能够拍出来，便是光明。"
"相约天涯路踏遍","5915","陆毅在里面格格不入，可能是演技问题"
"青麦弄影","6503","说不真实的小朋友可能对真实的中国官场一无所知，虽然也不是百分百还原吧，但是这种拖沓，滴水不漏才是体制内开会，汇报工作应有的样子，大家不要看多了美剧就以为全世界的政府机关都是美国那个样子的。没有流量小花鲜肉，比仙侠魔幻剧好看就行了，对现在的国产电视剧我也没什么别的奢求了。"
"乐知","4982","公安部拍了湄公河，最高检拍了人民的名义，明年就看最高法了"
"晨熹","5390","第一集看完。作为一个体制内的人，我真心觉得非常好，里面部分情节就像平时真实的场景历历在目。真实反应中国的政治生态。第二集看完，侯勇的演技都入神了，不愧都是老戏骨。"
"巴啦啦小魔仙","5030","好作品，好剧本，好班底，好阵容。六星。 其实芒果也播过很多神作，豆瓣9.6分《大明王朝1566》当年就在芒果播出的，《恰同学少年》《四十九日祭》《走向共和》也是芒果投资的，证明芒果不忘初心的正能量一面，芒果的初心一直都在，就像播《人民的名义》一样，花2.2个亿买下来，值得鼓励。"
"李小砚","4369","我一个95后女孩子竟然迷上这部反腐正剧！还到处安利，不过真的好看，剧情紧凑，尺度和格局够大！新时代的《官场现形记》，老戏骨们也真是没得说！全是戏，台词有时都是多余的，一个抬眼一个挑眉全有了，可谓“谈笑风生间激流暗涌，一来一往中绵里藏针”，唯有佩服！"
"死后竞选上帝","3736","反骨仔们请不要因为立场问题刻意打低分，好吗？虽然播了没几集，但是我觉得很精彩，尤其是剧情一层层拨解官场错综复杂的关系  和监察局办案时的无助。（剧情紧凑方面：50多集的国产剧当然没有七八集一季的美剧紧凑，希望各位能宽容看待中间拖沓的地方。毕竟中国正剧走到这一步不容易）"
"蓝帽闪亮亮","3011","陆毅就该拍这样的剧，又帅又正。其实我觉得陆毅演技挺好的，没有被吊打啊，而且陆毅底子就不差，当年《永不瞑目》的演技也很出色，可惜结婚了之后，也没有好资源了，只能急功近利接于妈剧试图回春，悲剧的是口碑还跑走了。但是陆毅的发挥至少是不出戏的。"
"西木","2179","当初跟周围人推荐这部剧，都是嗤之以鼻，不想了解，以为就是部伟光正。后来铺天盖地的舆论刷屏之后，大家才都纷纷下海。舆论，统一口径，想想也是个挺玄妙的东西"
"361","1183","一开始台词非常尴尬，陆毅柯蓝等人演技非常出戏，一举一动都企图强行撩你：老子看上去是不是很正气？这个逼装的帅不帅？……后面还不错，因为陆毅戏份少了哈哈～其他演员是在用心和神演戏，陆毅是在用眉毛和皮肉演戏，做作得很。"
"时光荏苒 `","945","导演能力太有限了，同样的剧本，同样的演员阵容，如果换孔笙导演，那品质就提高不止一个档次了。第一集就槽点多多，演员的化妆跟服装还停留在90年代，拜托，现在随便一个银行职员的打扮也没你这么土吧？你这接地气接的有点过了吧？还有那个书记的黑框眼镜，我去！这种权贵你就不能整个金丝边框的么？"
"方丽娟啊阿sir","1215","侯勇演技太好了……我都快要同情他了。道具扣一分，尼玛就不能放两张真的人民币？！颜色比冥币还假"
"徒然曜日","869","侯亮平评价蔡成功有一句话细思恐极：「他是输在起跑线的人」。片中公检法主人公，都是赵家人，不是师生、血缘、夫妻，再不济也是同学相隐，他们仕途顺畅光环逼人，而且最可怕的是化身真相正义，寒门出仕的幕僚连着商人个个自带原罪，有权必贪，有商必奸，再如何遁逃都是赵家刀俎之鱼肉、膝下之囚徒。"
"文品","946","太不接地气，陆毅一脸正义的台词，真的很让人尴尬。"
"Evan S.","1179","本来呢三星四星都正常，但我就想问问那些因为主旋律就打一星的，《钢锯岭》、《独立日》打没打一星？再问问那些看了一集说“恶心”的，老外搞政治宫斗一样一样的，改说英文，套上西装，语速加快，再把“人民”换成“自由平等”，怎么就不觉得“恶心”？"
"酒醒何处","1436","紧凑，真实，汇报与对话开会冠冕堂皇，瞻前顾后太真实了！"
"天空中最亮的星","1136","尺度惊人！！拍的非常真实！看到官小权大的处长满嘴仁义道德贪婪无度，副市长接受投资商排队敬酒拍马屁，几个省委领导汇报讨论汇报讨论互相扯皮为了私心，2亿的钱埋在墙壁里被查到时的绝望悔恨。强烈推荐！"
"我得改个名~","548","看了4集了，真的没有人受不了里面大段大段的说教吗？明明剧情就不错啊"
"胡弃暗","494","看了两集，9分过誉了，5.9分还差不多，官场生态刻画得挺像那么回事，但人物塑造得太令人尴尬了，尤其是那个出逃的副市长，简直就像弱智一样，小官巨贪的情节则铺陈得如同新闻回放，总之缺乏真正的深度，是群众喜闻乐见的保健品，并没有什么药效。"
"许卿倾城","502","陆毅简直了，老鼠屎最佳代言人，舍你其谁？"
"木亦","768","第一集，有个小细节，陈海和季检在车上往省委去汇报的路上，给候亮平打电话的时候，特地打开了车窗，，，当然，也有可能是我想多了，哈哈，第二十一集，陆亦可她妈给侯亮平打电话的时候，老人家屋子里电视上放的电影居然是华尔街之狼。。。233333"
"苏乏","547","有人厌弃这剧，我能理解，因为他对这个国家其实是失望的，所以认为是政治宣传，觉得就那么回事没必要叫好，但是我要叫好，因为我在乎仍旧于渺茫希望中沉浮之人的死活，在这身不由己江湖中还未放弃的人，必定和我一样心中有恨，时刻准备着杀出一条血路，让正义绝处逢生"
"阡陌之尘","475","这些台词看的我跟在上党课一般，特别不舒服，要表达的东西是好的，但为什么非要那么赤裸裸，能不能委婉一点。哪些官员之间天天都把党课的东西挂在嘴上吗？给人特别做作的感觉，看不下去！"
"局长","258","特别 韩红看了想打人"
"同志亦凡人中文站","295","不说人话的主旋律电视剧，和当年的唱红打黑有什么本质区别？都是拿艺术当陪酒女。别以人民的名义恶心我，小心我以月亮的名义惩罚你..."
"黄艹艹","858","第一集信息量太大 虽说“拖拉” 但这就是官场百态啊！"
"飞了","568","很多年没看国产剧了，这部戏却意外地吸引人，看了一集就放不下，做为一名曾经在体制内工作过十多年的人，我要说这戏对各色官员们行为，做派和说话方式还原度达到80%以上，不同就在于戏里演员们的身材太好了，真实的官场老油条们可没这么好的版型"
"星野变","306","24年前，《我爱我家》里满口套话、大词儿的老革命、老干部傅明同志让我觉得亲切、可爱、幽默，如今奋斗在反贪一线的夫妻俩在家里也是同样的套话、大词儿，怎么就让我觉得反胃呢？"
"DorisChau","661","五星预定。「与一众老戏骨对戏，陆毅单方面被碾压。」"
"无毒","324","五星给演员！结局应该是某些腐化分子的落马告终，不会上升到对整个体制结构的反思，主题无非“上头本质是好的，不过出了些害群之马而已”，大陆剧一向极度正确造成观众反感后，出现这样一部""意识输入""不那么简单粗暴的剧，瞬间被捧上天，大陆观众在审美上的“斯德哥尔摩症”暴露无遗，真是细思恐极"
"三太子。","432","有段时间流行考公务员，不是为了能为老百姓办事，而是羡慕体制内的朝九晚五旱涝保收，分配到国土煤炭公检法系统更成了隐晦的好单位。逢年过节同学聚会常把升官发财挂在嘴边。当我们为腐败道贺，为权利祝福。国家乃至民族的信仰正在一代代的缺失，而这些腐败者，正是这个国家与民族的叛徒。"
"squiggle","428","第三集开始好看了。不要再为陆毅的演技洗白了，就是烂剧拍多了回不来了。以前永不瞑目多有灵气啊。别说是因为年龄。像周迅梁朝伟梁家辉这些天赋极高的就不比了。戏里面陈海演员年纪应该跟陆毅差不多，台词功底神情动作比陆毅细腻多了。还有张博，大秦帝国崛起昭襄王，82年的，演技更是吊打陆毅啊。"
"无情小猫","373","陆毅和侯勇对戏，好像小学生对老教授呀。。。后面的几个男配角都好棒"
"宋小卡","443","至少在2017年，这部剧值得打五星。ps，打一星的小胖友，你们是不是也拆过共享单车的脚蹬子……"
"读诗人-公长","186","我去...我的一星评论竟然被删帖了，细思极恐，本以为是中国观众很好骗，但没想到是这个原因。"
"血仍未冷","248","陆毅的反贪高官形象极不可信，像一位除暴安良的江湖侠客，里面的官员用的手机全是小米，他们的属下跟老婆们全是iPhone 6。"
"早啊","387","现实中我真见过陈老这样的离休干部，外公是抗日老兵，住在干休所，因为冬天烧水一个月用了党三百多块钱电费就自责一年，是不是电视剧里拍的中国没有那么不可救药，所以那些傻逼们就看不惯非要打一星啊？"
"几灰魚","188","片面真相代替真相的手法，见得还少啊？纪实性虚构片。"
"柿子青涩之时","262","我觉得你这个同志 很搞笑 ！"
"亲爱的桂花树","213","这部戏最大的败笔是找了陆毅这种没演技的演内心戏丰富的人，又找了个和陆毅有仇的化妆师。陆毅最大的问题是和灯光师又打起来了。另外柯蓝特有女纪检的感觉。年轻演员的演技都浮夸，但剧情特别特别写实。我给三分，第四分一分给老戏骨们，剩一分给豆瓣。豆瓣敌人太多了，这部戏可不敢恶意评价。"
"沙瑞金","444","达康书记别低头，GDP会掉！别流泪，祁厅长会smile,京州的gdp由.com来守护，人民的豆瓣由.com承包"
"蜜斯鲤","237","一帮裙带关系的伟光正，这是告诉我们只有根正苗红才能当好官啊。"
"summer","148","我不喜欢这种样板戏，我也不想过多的评价。"
"王呆呆","203","这部电视剧最失误的就是一开始用了侯勇演一个配角，让后面所有主演的表现全都黯然失色。"
"李荷西","188","服了。副市长逃跑，在飞机上露出得意的微笑？怎么可能呢？陈海被撞的人事不省才几天，陈岩石和老伴儿回到家谈笑风生地迎接了小金子。“什么时候觉得自己不是亲生的？”陈海躺在病床上，艰难地抓起了话筒。"
"燕赤侠","135","豆瓣你怎么了"
"刀豆","205","陆毅二十年如一日的花瓶，气质油演技渣。柯蓝好，中老年绿叶们也好，其余年轻演员感觉既没吃过猪肉也没看过猪跑。槽点差不多和亮点一样多，名为反腐更像高级黑，处处黑。"
"iLsy是凛","181","陆毅和赵子琪在电脑前关于党员，反腐的对话真是让人尴尬。"
"南文","140","官场戏是否表现到位，我不知。但年轻演员的演技降低了品质"
"小R","231","这剧真不适合那些十几二十的小孩看，担心他们看不懂。  中国的官员那个中庸啊，那个圆滑啊，怎么描写都不为过"
"轻舞","390","人民的名义，第二集，侯勇老师的演技简直炸裂。"
"HolyC","123","所有直指要害的低分评论忽然消失,某些豆瓣网红的广播也蒸发无影,豆瓣也沦陷了?"
"sophie","215","说尴尬的我就呵呵了，不知道现实真的就是这样的吗？"
"我是骚当","325","有点牛逼，而且重点是！都是原声！没有配音！还有，关弹幕！！！保智商！！！"
"扭腰客","35","就像奥运会诞生了无数表情包一样，主旋律在被娱乐化包装后，似乎是没那么讨人厌了，但本质依然是主旋律。书记表情包大泛滥，再次证明：某种程度上，娱乐至死是比政治高压更“温水煮青蛙”的工具。"
"小田切梨","128","被安利看了五分钟。开场北京地标的延时摄影，强行尬纸牌屋，也不晓得在哪个论坛买的素材，色调、节奏都不统一。陆毅演的侦查处长出场给的是教父式的“后脑勺调度”，一群小跟班活生生尬台词，还没等镜头甩到陆毅正脸，实在忍不住关了。中国人拍政治，原来别扭的不只是内容，连视听层面也是。"
"旅途人生","335","不是中国没好剧！是好剧真的太难生存了！首先，这是一部最高检牵头的剧！和湄公河一样官方背景明显！不过注重市场规律，没有过于美化！其次，这剧不如湄公河就是不是硬汉电影！官场腹黑学的作品！老戏骨的内心戏尤为突出！不见棺材不落泪，特别真实！终于看到一部真正意义上的开年大局了！"
"太史政","81","當下社會反腐劇的前提是有腐敗存在，只此一點，足以表明社會的不正常。何時沒有反腐劇了，或者反腐劇成為歷史劇了，那才是真的好。另外，就衝劇組威脅并狀告普通人這一點，就讓人噁心一萬次！"
"有涯之生","173","今年最大的惊喜，内涵至深，作为体制内的，有时看的浑身发麻"
"瘸腿蚂蚁","125","看了十分钟就被恶心到了，装腔作势，BUSHIT."
"肥嘟嘟左卫门","98","中国观众是多少年没看反腐剧了吗？当年大雪无痕什么的，尺度比这高多了啊。这片充斥着各种propaganda， 仍然基本不说人话（公开场合的确这样，但私下场合那点“好人的小情绪”也假到爆炸好吗？主要是侯陈沙这种好人现实中不存在）看到评论“老戏骨飚戏”这几个字就恶心，你看过多少戏好意思这么说？"
"竹刀穿林","124","和纸牌屋比，其实还有很大的差距。考完纸牌屋，你会觉得政治里没人好人，并且理解人性的黑暗与贪婪。但看完这个，你只觉得，哼，叫你坏，被抓了吧！你只能看到一个政党让你看到的进步"
"taoxinxu释凡","225","芒果台花2.2亿购买反腐大戏，丁义珍副市长海外潜逃，牵扯土地、矿产、旧房管制案件。侯勇私拿2亿多却不敢花，贪婪大门开恐怖难收。一群老戏骨扎堆，陆毅太内敛，吴刚活灵活现...编剧周梅森挺懂贪官反侦细节，感觉前面剧情有点波澜不惊、节奏略慢，希望不要《北平无战事》那么装腔作势、打反腐旗号骗钱"
"Whysoserious","119","总制片人、总发行人、领衔主演都是高亚麟。夏东海不是儿童剧作家吗？！开始拍反腐剧了？！是为了教育当卧底的刘星吗？"
"贾葭","89","看《人民的名义》，要不是几个熟悉的取景地，差点没认出来改头换面的大南京。眼前飘过一窝市委书记：王武龙、李源潮、罗志军、朱善璐、杨卫泽、黄莉新、吴政隆，平均两年换一个，这个城市太委屈了。"
"古尔齐亚","60","此剧最大的亮点不是展现腐败，而是公开承认地方政府串通流氓拆迁队搞强拆，并且公开承认删帖删不过来"
"sound of colors","123","这部剧看跟谁比，满屏都是烂剧中算能将就看的，跟以前那些经典片差的太远，除了一个反腐的题材加上老戏骨的演出，最让我受不了的就是苍白的台词或者说是剧本太平凡了，尿点太多，毫无深度"
"小岩井","92","本以为会很主旋律，没想到展开这么真实深入，带感。最让我激动的，是看到了小时候的女神胡静。"
"epiphany","63","第三集之后看不下去了，哪里好看了。。。"
"非魚","73","家中好几位供职公检法的成员都认为是幼稚的洗脑片，无脑的五毛们还吹捧什么呢"
"大萌妹买买买","94","副检察长的儿子是反贪局长，大法官的老公是省委副书记，大法官的侄女反贪局处长。系主任带出来的学生都是官，一个比一个厉害，其中他最看重的学生会主席是本片的男主角（陆毅饰演）。这是不是高级黑啊？"
"念末麦","66","官方营销之强大，豆瓣知乎怕也是无奈，样板戏随时复燃，搁哪个年代，人心人性都并不会真的改变太多，同样的套路可以洗脑不同代的人。"
"BenOZ","82","如果这个能打九分，我为以前黑过的所有国产片道歉：《富春山居图》《十二生肖传奇》《抗日奇侠》~~~"
"李然","102","大陆的政治题材这尺度也是一种突破了，起码比无脑抗日剧、弱智玛丽苏好多了。全程演技在线，尤其侯勇和吴刚。部分反映了现实官场，现实的中国官场就是这么复杂，很多情况，人情大于法治。不过我还是觉得，现实官场里陆毅都活不过第一集。涉及根本性的东西还是有所保留，毕竟民意和民义太不一样！8.2"
"阿凡思蜜达","181","汇报紧急任务前先拍马屁的大段前戏，敬酒桌上的人情百态，气急败坏训斥下属的高高姿态，非常真实。繁冗、拖沓、极端虚伪，这就是中国官场政治的常态。敢于把它揭出来，好歹还没算烂到根里。"
"一醉累月酒星魄","47","向我们生动地展示了1984式生活。"
"申甲由田","40","门生故吏，同窗发小，父子母女，夫妻翁婿……[捂脸][捂脸][捂脸]"
"不二喵","90","为什么我觉得很拖沓，演了半天一个要把送礼的花送给养老院，演半天。张嘴就给我派个车，哪有那么多车给你派啊，还有那个挣钱，和爸爸bbbb扯半天，剧情完全没推进"
"盐","47","对政府的不信任感使得国产剧中出现对权力的讥讽即成为赞同点，该剧最大的弱点在于对贪腐的定义，没有绝对的贪腐，只有永恒的利益"
"所以说呢","75","哪里写实了！体制内哪有中年不秃顶不发福的局长！！！！！！"
"越‘界王","73","政治戏比反腐戏好看"
"二手狮王","119","打四星，是因为被评论里一大部分小学生恶心了，逢共必反。还有评论里说上维基外网，了解了中国官场客观状况，以及着装打扮太丑打一星的，你们是来搞笑的吧！这部剧往后看也有一些缺点，说教太重，意识形态灌输也让人不舒服，确实有点主旋律。这部剧表达着，党内只有几个害群之马，整体是好的！"
"8th_Montaigne","130","時代洪流中的官場現形記。"
"微疏","96","一日降到8.8，一星远比二星多足以反映是赤裸裸恶意差评了，阿北真的需要多想点办法拦水军了"
"渡辺纯一","56","严肃文学。"
"请叫我越王","210","就冲前两集侯勇的演技也得给5星"
"毛路","45","不喜欢这剧跟政治没有半毛钱关系，纯粹受不了浮夸的演技和台词，春晚小品既视感。看了两集，弃。"
"外来务工人员","28","保佑豆瓣从抱大腿做起。"
"水瓶座女孩","71","原本觉得为什么年轻一代的反腐先锋全是官二代而细思极恐，真正深入思考后反而觉得这是一种真实的体现：没有相当硬的官方背景不可能年纪轻轻就身居高位；正因为出身好从小什么都见过都不缺所以才能做到不被金钱利益迷惑本心、进而反腐而不是贪污！PS同理可证为何开国第一代都出身良好而不是寒门～"
"Hit the road","139","中国人做主旋律终于没有那种令人尴尬癌的歌功颂德感了，涉案剧时隔十年再次回归，希望能再掀风潮"
"万宝露小姐♥","55","节奏太拖沓，对白太说教，几个故事穿插剪辑严重影响情绪流，题材是好的，但是整体水准真的是对不起目前的高分。"
"璇玑","71","可怕，没看到腐败，看到了门生故吏、盘根纠结，看到了世家子弟与寒门子弟的对立；人设还停留在几十年前、远远落后于时代。不是有几句台词就是最大尺度。这剧担不起盛誉，我非常疑惑高分是咋来的、一边倒的赞誉是哪儿来的。明明十几年前，诸多反腐剧比这剧更值得观看"
"北极熊绵绵冰","53","每个人好好说台词就能成为神剧了？？？"
"饭团裹卷饼","64","目前来看这剧还是不错的，但是也有让人无语的，汉东检察院派遣2个人去酒店盯那个顶副市长，结果那两个人喝着果汁聊着天还把人给盯丢了，这tm是智障吗！简直无语。看到第八集就醉了，那个陆处长是什么东西，她有什么资格对一个局长甩脸色，那女的简直脑膜炎发作。"
"落宝地","46","垃圾"
"XBH","49","服了热评"
"废柴少女","58","中国农民那么倒霉有你这么个坏儿子"
"支jew庞克林廊","43","引用 “故作真诚的样子比不要脸还吓人 故作敢言的样子比平常更不要脸”"
"拔刀诀","36","题材尺度大了一些，老演员都比较靠谱，官场部分贪官部分看着像那么回事。但一到反贪局检察院的戏，台词矫情做作，表演生硬拙劣，用轻佻冒充人性，陆毅两口子在家都不说人话，跟在会场发言似的。编剧导演要么是高级黑，要么是能力差。"
"zts","108","演员的台词功底，稳健的镜头调配和合理的多线叙事秒杀一众单纯贩卖明星人气和颜值的IP剧；聚焦近年来最敏感也最受关注的时政议题，俨然一股不可多得的荧幕清流；将严肃政治题材进行通俗化改编尝试，让人有谍战大戏般的过瘾体验，这样的良心剧，必须要推荐！"
"長風寓公","28","鼓吹擦屁股技巧带来多大爽快感  有助于解决拉肚子问题嘛"
"SCIFI","46","鼓励一下吧，说比纸牌屋什么的实在有点夸大，剧情还是单薄，只是替憋屈的人民出了口气而已"
"Sumwood","59","看到6集，这剧集的套路，我明白了。烂的全是地方的官员，中央的全是伟光正。最大的boss应该是高老师。可笑的是演正派的一方也充满了各种人情"
"linn","70","那些打一星的，你是不是心虚？这是好片，开头五分钟我就知道这片子我要追，一分钟都不能错过。揭露黑暗，便是进步，无论如何要前行，公仆腐败苦了的是百姓！"
"Mark哥","118","感觉比看纸牌屋YY美国政治好多了"
"易老邪","17","so so"
"苏先生","74","真是比美剧还好看，每个人人物的出身导致在事业上的野心和格局，穷不为官，是真的。"
"InitialD","45","这剧什么都好，就是导演水平太差。我还以为我在看一部90年代的电视剧。镜头切换混乱，叙事方法老套，时不时还有让人不能接受的穿帮镜头出现。让人没一集都能出戏。就和中国足球差在裁判一样，国产剧差就差在导演和后期制作中。关键那么多年还没有任何进步也算开了眼了。"
"济公有洁癖。","49","看到第八集了，节奏越来越慢，越来越慢，所以你们是为了把这一件事拖到56集故意改变了打开方式？"
"月落西橋","97","某些人不提演技二字，就感觉装不了比体现不出自己的鉴赏能力"
"[已注销]","66","反腐在路上的电视剧版，把贪腐归咎于个人的贪腐，厉害。难道只有我一个人认为这只是某党的宣传片吗？看了几集只感觉人民公仆党员都在电视剧里，出门办事还是那个样，片里面的省委书记在层层阻力下贪腐，在公检法都那么公正执法下还能贪腐，一个人背了所有的锅，中国这种清官意识要害死人。"
"Hank","42","赞美这个剧尺度的傻逼可以拉黑我吗"
"璎珞","40","观后感：农民的儿子就不要当官了…"
"妳De呓語","38","看了两集，想打5星。看到七八集，想打4星。现在看到15集，只想打三星。越来越拖沓，从紧凑的悬疑剧，变成婆婆妈妈的都市剧。有点失望。"
"达康书记的GDP","82","其实我没有给国产剧打分的习惯 一般就算看完喜欢的剧也不会打分 我要保持高冷的美剧党的形象 但是我太喜欢达康书记了 达康书记的gdp由我来守护！达康书记的眼睛里有星星！"
"内陆飞鱼","9","想了一下，反腐要想快刀斩乱麻，高速、快捷、有效，好看又漂亮，可能还是应该给巡视组、反贪局佩戴尚方宝剑，树立一批像包拯、海瑞这样的清官，上斩昏君下斩谗臣，而且可以先斩后奏，人民群众一定拍手称快。"
"丁一","9","电视剧不能看，一看就停不下来，像贪污腐败一样。电视剧不能停，一停下来更想看，像反腐倡廉一样"
"阎浮提","35","刷本感情线生硬，人物塑造模糊，一味高大全伟光正，花瓶酱油角色太多；语言过于书面，不贴近生活；戏剧5要素缺失数个，剧本上实在不算佳作，言过其实。两星给老戏骨，不能更多。"
