"字段1","字段4","字段5"
"大眼仔Lawliet","0","给这部戏的所有演员，尤其是老戏骨的演技跪了。膜拜ing。细节演的太到位了我的天，好久没看得这么爽了。  顺便说一下：政府依法行政，党依法执政。还是有台词错误的，而且是硬伤哈哈哈。"
"哎哟小篆","1","题材挺不错的，而且紧跟时代，不会因为反腐反贪而显得古板。虽然陆毅这么多年演技就没提升过，还是那么浮夸，但是一帮老演员都挺有演技的。"
"宇宙拖拉机","0","其实还好，但是总让人有种“普法栏目剧”“公开理论讲堂”的感觉，以及在一些无关紧要的配角身上花费太多时间拜托谁要看他们啊"
"野月花环","0","久违的官场剧，演技剧情都在线，但是，剪辑能不能走点心，动不动一段镜头没看完就切到另一个。"
"鲁阳","0","陈岩石和陆怡可就是傻逼"
"崇治88","2","看到第二集，那道钱墙，我傻了，看到侯勇情绪把控动作拿捏，我服了。"
"清欢","2","真实，有力量"
"我lu不会飞","13","这部剧真的很赞，官场如赌场，水很深，这些老戏骨演的不错，希望这种剧能够多一点"
"项羽很忙","0","陆毅跟这些演员比太出戏。。。检察院的贪谁来反？任何一个官员屁股都不会干净"
"记忆中的童年","4","确定没有水军？我不信"
"明湖大闸蟹","0","牛批"
"黑山老妖","0","我很好奇那些打一星的傻逼都看过什么好剧呢？"
"Crstie","0","好久没看这种电视剧了，演员演技好，都是老戏骨。建议观看。"
"智","7","一到陆毅就快进 一到达康书记就恨不得慢进"
"被窝","14","gross ＆ disgusting"
"本初","0","懒得多夸了，好看，五星"
"[已注销]","8","鹿哥痴迷此剧，因为是妈宝男所以婆婆被她儿子安利的神乎其神，接下来一顿吹捧儿子的品味好，婆家人人手一个手机都在看这玩意儿。。。啊 各位醒醒，这是广电总局审核过的电视剧啊，好多人说广电总局尺度变大了… 仔细想想，这可能只是官场的百分之一面儿？"
"汪汪汪","2","国产剧的突破，希望未来好片越来越多。"
"米斯特维戈","0","全员演技都很棒，作品描述的官场很黑暗但这就是事实，希望反腐倡廉之路越走越好，尺度放大了就出现这么好的作品，真的不希望广电再乱搞"
"lionhate","0","国产片拍成这样很好了，就是剧情慢了点。"
"蓝色的猫","0","这个片子题材很不错，侯勇老戏骨演的真心不错，看老戏骨演戏就是爽，演的就是厉害啊"
"好雨知时节","0","难得的好剧"
"暴雨梨花针","0","一星，五星，这是刷的吗????反正是第一次看这类型的剧，还不错的说。"
"Torry","4","黑洞 v2017"
"墨普德仁","0","看了两集，觉得确实是一部好剧，但是五星还不至于。本来想给四星，但是看到那么多无脑五星的，我来个两星中和一下。"
"掘藏","0","看了前两集很高能决定追下去，这部剧的尺度确实蛮大的"
"march27th","0","本来是给五星的，老演员，题材，都是良心之作。但架不住郑胜利、陆亦可和林华华啊。没有郑胜利，估计本剧可以精简十集"
"ruining29291","1","书的节奏不及电视剧，少数电视剧的人物演绎精彩于书籍的刻画"
"＠(￣-￣)＠","0","终于又看到这种题材的片子了，而且目前都很不错，节奏也挺紧凑的"
"风云飞鹰","0","了解"
"勺月","0","还是有点拖沓。剧情再紧凑一点就好了。"
"摇摆少女","0","喜欢达康书记～"
"维生素C","0","啥都不说了  就是好看"
"木头刻呢","0","天天等更新，为啥更新这么慢"
"young","0","首播湖南卫视  开播后被阉割  一个小时 变成五十分钟  不然给五星"
"义薄云天","0","所有人演技在线，官场百态也揭露的比以前深刻，看纸牌屋都在拿利益游说，看这部剧都在为官运踢皮球，真是国情不同，却当官的都一个德行——天下攘攘皆为利往"
"Simple","0","神TM烦 陆毅 柯蓝 华华 还有他妈的郑胜利！"
"段宜恩","0","营销太过了很讨厌"
"薇薇鱼","0","看得停不下来因为郑乾这条线扣分"
"武乐888","0","看到第四集，先5星"
"Maples7","2","牛逼了！只求不烂尾！"
"养乐多不绿","3","真实，紧凑，台词生动有趣，表演用心有张力。第一集检察长做事面面俱到，两方不得罪。汇报瞻前顾后，暗藏玄机。第二集对穷怕了的贪官心理刻画的特别真实，从开始的侥幸，到后来的后怕主动招供，不得不感慨演员侯勇和剧本的实力。年度剧王预定。"
"机智如我","0","看了一集以后竟然就停不下来了"
"苏酒","0","这片主线还是蛮好看的，几个男演员的戏都不错，就是一到女性角色这真是倒胃口，把林华华删了我再多给半星，人设够讨厌就不说了，演员谁塞进来的啊戏假的我都要吐了"
"那一笑的风情","0","看到第2集的时候我笑了，一个大贪，轻轻松松跑去美帝，居然一分钱没有，被呼巴掌，当苦力，关键还有个在美国的妹妹。请问钱呢，你还有智商吗，就你智商还市长，你连我们家的老母猪都比不上吧"
"达康书记的长腿","0","这剧打一星良心不会痛吗？恶意差评太过分带路党太多"
"藕香零拾","0","必须5星。外行只能看热闹，演技真的没的说，陆毅这样的演技台词功底都被碾压了。"
"……小小井","0","截止第五集。满分"
"银他妈三西","0","看了20集，情节太拖沓了，特别期待后面结尾"
"高等游民","0","其实真的应该表示支持！辛苦大家了！是个良心剧！"
"颦身未展眉","0","演员的台词功底，稳健的镜头调配和合理的多线叙事，都让看过不少硬件上不忍直视，单纯贩卖明星人气和颜值的IP剧的我感到十足的诚意。"
"abracca","0","真的很好看，不仅反腐尺度大，不是隔靴搔痒，还很贴近现实，反映了很多社会问题，说出了我的心声。这个社会太浮躁，做事不用心敷衍了事，只想赚钱，不想承担责任没有奉献精神。"
"连山归藏","0","一步反贪剧看得我热血沸腾。。。表白陈海。。"
"五公孓","0","其实节奏把握的也没《北平无战事》好。老戏骨演技撩人，候亮平跟方孟敖差不多愣头青人设。"
"归stone","0","真佩服你们那些打一星的键盘侠。"
"iivee","2","目前为止很满意"
"倦酒","1","好。官场百态，良心制作。"
"幻瑶hay","0","虽然很少看，但确实很不错"
"剩女队妈妈桑","12","柯蓝不能忍！"
"禾子安","0","五星力荐，项目处处长贪污两个亿一点不夸张"
"huron","0","说这是反腐歌功颂德片的智障了吧，这黑得有点伸手不见五指啊"
"blb","0","已自觉自愿认真上了八集反腐宣传课。丁出逃、蔡举报略有趣。"
"zilu","3","这部戏有点当代中国官场百科全书的意思。哪怕手法再老套、话语体系再奇葩，也有难得之处，与其说是尺度大不如说是对于中国政治制度提出的一些问题值得被拿来讨论。当然如果官方只当其是一部反腐表决心的戏就另当别论了。"
"格格千岁千千岁","0","想给10分"
"渊澄","0","老戏骨本职工作比小鲜肉做得好！感觉之前看了十几年的电视剧我是不是看的是假电视剧，为什么从小到大都是各种辣眼睛的偶像剧"
"哥斯拉","0","再一部琅琊榜一样良心的国产大片，每一个人物都太入木三分了，陈老是本片最煽泪点角色！"
"他的国","0","司法系统不能独立啊，一旦独立有些东西就不复存在了"
"neilyo","0","牛逼牛逼！尺度真是够大！老戏骨演的太好了！达康书记的GDP由我来守护"
"仁仁仁慕慕","0","就是五分"
"橘里","0","不错！在追剧"
"january","0","有小瑕疵 但是很不错 希望以后多点这种剧"
"Sapphire__蓝_","0","好剧！陆毅演技挺好的呀为啥这么多人吐槽…看老戏骨们飙戏太爽"
"不言不语","0","感觉在一众老戏骨演技派的衬托之下陆毅成了小鲜肉，年轻又帅唯独演技一般，这是看了几集感觉最大的短板。也很难说好演技演这个角色会是什么样的，但是我觉得霸道强势和咋咋呼呼浮夸还是有区别的，一味的耍帅凹造型只会让人反感。拜托只是比老戏骨们年轻些，早就不是小鲜肉了好吗?"
"Louie","0","有生之年"
"琐碎的繁花","0","看了十集"
"你看见的是谁","0","还可以了，这尺度"
"微若尘埃","0","被剧情全程吸引！"
"葝我","0","剧情其实略拖沓，但题材好，剧情也不错，老戏骨飙戏太过瘾，追了。另外，让某些人看看，没有流量和粉丝基数的剧，一样能大火。"
"姝","0","评论很有意思。喜欢的多半打五星，且评论也是较中肯的一大段，不喜欢的呢，多半打一星，评论则是偏低俗的一句话。孰言可信，观者自明。就目前看的八集而言，整体来说还是相当不错的，缺点自然是有，我也觉得说教的台词有点多，使剧情变得拖拉，但优秀还是占主导的。"
"季末落泪1987","0","难得反腐题材  不是按有些看众想怎么拍就怎么拍的  加上总局审查力度能这样已经不错了"
"娜娜","0","难得一部好剧，用某一个演员的名义打那么低的分，真的好么？一分？呵呵哒，这些儿童适合去看鲜肉剧"
"赤白干净的骨头","0","看了两集看不下去，逻辑不清，编辑混乱"
"不大董","0","象征意义虽重，虽是奉旨反腐，但还是值五星"
"阿九仔","0","演员好 剪辑烂 跳戏跳的连贯性和气氛都没了 莫名其妙 真的不懂郑西坡跟他傻儿子这条线什么意思"
"饼干","2","老戏骨演员，体制内，尺度大，剧情非常真实，反腐，有诚意。"
"magi","0","追到废寝忘食"
"何金银","0","被郑胜利一家拉低了分数"
"刘孙驰艺","1","就是为了这群演员也要看下去，终于不用看披着各种外衣的偶像剧了！"
"→紅魔附身★","0","如果压缩成15集。删除小年轻的狗血情节。兴许能赶上纸牌屋的一半"
"Alan Shore","0","恶意刷一星的太多了，中和一下。"
"蛋炒饭","0","来减一颗星 立意和格局都不错 除了陆毅演员们演得也挺好 但为何剧情越来越拖沓"
"发条橙子","0","人物太脸谱化和剧情太戏剧化了，说教的东西太多，正面人物正直的都显出戾气了，缺少接地气的东西，人物都不在生活中，混混都顶着个杀马特头也是醉了，典型的主旋律。而且看了四集发现里面的裙带关系真吓人，两口子都是官，爹妈儿子都是官，七大姑八大姨全是官。导演这是高级黑吗？"
"可达鸭式凝视","0","我爱北京天安门，天安门上太阳升"
"Gypsy","1","越看越有意思 很现实 经典台词也很多"
"旧时光","0","大boss会是高育良吗？"
"暴躁的文青","0","敢拍这种题材就值得高分了，把官员的虚伪和贪婪表现的淋漓尽致"
"清蒸鱼","0","很好看，老戏骨的演技真的没得说，陆毅感觉没以前灵性了但也算中规中矩吧。"
"做梦o","0","就喜欢这种勾心斗角的剧"
"darker","0","剧本扎实，表演精彩，前两集真刺激，那个堆得满满的钞票给人的视觉冲击太大了。"
"路见不平一声吼","0","感觉陆毅不错啊，为什么大家想把他换掉，哈哈哈"
"咕叽咕叽","4","政治大戏，真难得"
"乐之 Ritz","4","阶级固化比贪腐更可怕。编剧越是举重若轻，越是想让你打一星的地方，就越显得真实。https://zhuanlan.zhihu.com/p/26193015"
"枕言","2","老演员们都不错"
"可儿","0","为了wuli .com"
"夜阑听雨","0","五星预定"
"趿拉板","0","各路老戏骨对飙演技，看得酣畅淋漓"
"TakeItEasy","0","晚上看了两集，割裂感有点重，老一辈小一辈仿佛两部戏，听老戏骨念台词简直是一种享受，剧情展开的太慢了，然而这个尺度中国电视剧走到这一步不容易，深度对比其它剧已经很棒了，希望会越来越好"
"青云一抹","14","这片子有人恶意刷一星啊，背后的原因是啥呢？"
"懒女人","0","好久没看到让人心潮澎湃想追着看的电视了啊，被达康书记妥妥的圈粉啊"
"nightscape","0","呵呵，洗脑愚民剧。"
"萌萌的牙刷","0","超好看"
"越光宝盒","0","剧里面每个人的演技都很棒，永不瞑目后再一次get到陆毅。好剧本好班底好剧！"
"素红诗颖","0","老戏骨飙戏就是带感"
"老步","0","能过审确实不容易，但电视剧本身一般，剧情拖沓，演员过半演技不及格。三星到顶了。"
"牧天影","0","剧情连双十一都考虑到了，我服…"
"季南薇","0","李达康"
"画屏","1","陆毅演技被吊打，扣1*，其他都很不错，每个官员都像坏人2333…继续追！期待好久了～"
"咚古拉","0","你要说跟棒子黑zf比，真比不了，里面太多桥段太刻意了就是为过审，尺度大个屁，一直在歌颂共党"
"想睡觉的月亮","5","陆毅夫妻的感情戏是这部戏最大的败笔，句句打官腔，太想点睛，画虎不成反类犬"
"一川烟草","0","追该剧的间歇在补大明王朝，不说内容，就是剪辑和摄影真是差后者太多"
"A百优卡郑","0","虽然不能和纸牌屋对比，但在国内的大环境下算是一次突破了…不再是以往的小鲜肉唱主角，这才是国产良心之作！"
"波波波波波","0","这个尺度就足够5星了！好看～"
"菲林格尔","0","看郑胜利线全程快进，非常影响观感。把他们戏份删到每集5分钟左右我认为这剧就值5星了。演员很好，台词演技都很好，就是剧情怎么那么拖拖拉拉，怀念当初20多集完结的电视剧时代，篇幅有限故事讲的照样好。"
"后天","8","也许是我无知，在我的记忆里荧幕上能如此尺度的讲我国官场生态陈述给大众，已经是相当大的进步了，再加上众多的老戏骨精湛演技，力荐"
"咋还是这名字啊","0","毛毛虫好烦 什么时候能下线？！"
"2wice","7","拍的支离破碎的，情节和时间安排也没有掌控好，题材是加分项"
"冰糖葫芦串新莨","1","期待这部剧很久了，虽然没有预想的那么精彩，不过看一群老戏骨互飚演技确实是一种享受"
"噼里啪啦","0","检察院书记为什么总是不露面，怕人们知道书记才是一把手么？"
"精灵锴","0","经典"
"呵呵 你挺萌的","0","能不能少点客套台词，少点很作的特写细节"
"刺猬头","3","虽然制作还是就有点糙 但是必须给五星"
"镜影岚光","0","不错"
"如果时光会说话","0","看了一下午，在国产剧中真的是几年一见的好剧，演员们都是老戏骨，也比较真实，在各个角度反应了社会政府的看法."
"无法保存","0","继续看"
"Alan","0","强推！熬夜一次性看了7集，导演整部剧把握的很到位，较为真实的反映了中国政治目前状况以及贪污腐败的严重性，以一个处级干部贪污2亿开始，牢牢的抓住观众的着眼点。最后说一句，侯勇老师的演技真的牛B啊！"
"曦汐","0","可以"
"小新子O'Bright","0","第一集就陷进去了，等养肥了慢慢看，太过瘾了，这就是国产剧该有的样子，支持"
"怅归","0","第一集还可以，紧凑，信息量大，后面就弱了很多，感觉可以拍得更好，而且……确实过于主旋律了……"
"江南客","0","好剧！有没有人觉得吴刚像沈腾？"
"我是文人","0","真是太棒了！演技！台词！剧本！都有深度有内涵！"
"标准国际范","0","特别好看，无法自拔"
"doubleo","0","评分下降是不是因为郑乾这个熊孩子。"
"陌西","0","题材不错"
"雷电法王","0","前两集很好，后面剧情有点儿拖沓，但还是要支持一下。"
"大汪汪","0","不错"
"小殿","0","五星给侯老师"
"早安午安晚安","0","良心国产剧"
"skyero","0","中国官场的条条道道反应的很现实很深刻，值得看的官场之道"
"这个杀手太热了","0","尺度够宽，够大，可能是中国观众被以往的圈圈给限制得太久吧，感觉看得够过瘾。不过还是有些政治性宣传教育在当中。片中的老戏骨太多太精彩，反倒映衬出陆毅的格格不入。第一集的小官大贪是个亮点，侯勇演技够绝。"
"重度拖延小姐","0","非常有意思。"
"北不能漂","0","这也能播？"
"未见花开","0","之前看陆毅拍的叫什么玩意儿，他就应该拍这种电视剧，自从拍了云中歌，秦时，和胭脂，一度让我崩溃，当初那个翩翩少年郎啊，幸好又拍了这种主流正剧，国产剧只要开放审查的标尺，还是非常精彩的"
"小新蜡笔","0","很棒的电视剧，剧情很赞，剧里老戏骨们演技max。就应该多一些这样赞的电视剧，比那些脑残玛丽苏的电视剧好的不是一星半点"
"sunmile狮子","1","老演员们太有魅力了，从没有觉得出戏过，只想赶紧看接下来的剧情，就是有些剧情感觉有点拖沓= ="
"如沐春风","0","话不多说，能播就说明这个社会有光明！！！"
"Pual-yang","0","4.0分，郑西坡一家以及林华华这种搞笑标配一下子就把这部电视剧的档次拉下去好多，完全无法和同类型的美剧相比。至于人物嘛，缺乏深度，极其脸谱化，期待之后人物的丰富化表达。越往后套路越多，没必要每一集都要搞成三个场景来回切换，好多切换的场景节奏都不对的。"
"sevzzz","0","简直是在乌烟瘴气的室内突然打开一扇窗的感受"
"随往事疲倦","0","纪录片式的电视剧"
"工藤宇","0","表面文章 看不下去"
"niyousilea","0","剪辑太差了"
"龙吟且啸","0","真好剧 好戏"
"小七酱","0","那些打一星的，应该没考起过公务员"
"以 德服人","2","国产良心巨作啊。没有流量明星"
"小陆爷Starset","0","这剧太牛逼了！！太牛逼了！！太牛逼了！！重说三"
"lszer1","2","路桥山演的最好啊。"
"dyctdweee","0","往返路上"
"庸人俗人","0","怎么跌了那么多？"
"指间倒影","0","没有那些小鲜肉的电视剧就是好看，终于有以前看电视剧的感觉了"
"Honey甜心","0","很稀有的题材，演员演技大赞，可以说是国剧精品了！"
"罗夏的测试","0","演技全屌炸天 除了小陆 稍微跳戏啊"
"q恶作剧p","0","剧情节奏起伏非常好，几集看下来不多，但很多人物塑造已经很立体，这几年广电控制太严，所以好多好剧不是出在古装，就是各种情感剧，这部剧可能还不完美，但让我看到国剧在政治剧上的希望……里面好多老戏骨的戏真的太棒了，台词功力太强，相比之下陆毅都有点逊色，五星鼓励"
"任我逍遥","0","女的演得太过了"
"名号是什么呢","0","1，监控的时候不应该时刻盯着吗？竟然让丁跑了？ 2，发现人没了以后第一时间不查录像?一个个房间人工排查?3，一个市委书记，在风口浪尖依然强拆?zuo死?当这几年官是吃shi啊？  4，那个2亿多的处长，你胆小到不敢花一分钱，那没办成事怎么不退钱啊?这是胆小还是胆大?"
"1992txt","0","没什么看头，还没有正真的宣传反腐短片好看！"
"悠悠经年","0","我去~一群老戏骨还是这样的题材 这也太过瘾了吧 本来看到陆毅不想看来着 不是对陆毅本身有意见 而是以为又是偶像狗血剧呢 被别人安利才看 没想到是这么有品质的剧 必须点赞"
"黑龙江彭于晏","0","我国电视剧事业有望"
"初迹小涵","0",".....剧情挺好，老干部们演技也都超棒，就是太拖沓，太，拖沓，净扯那些有的没的"
"方小姐是我","0","好精彩啊！！！！好久没看那么带感的电视剧了！！！支持！！！陆毅好帅！！！"
"大维","0","这电视优点就不说了，都看得到，缺点在于说教的地方太多以及突兀的穿插感情线。"
"甄凱","0","政宣而已"
"苜蓿","0","侯勇 吴刚几个老戏骨真的演的太好了"
"llt","0","正的太正  腐的太腐    现实应该是一片灰色内斗"
"时代凯芙拉","0","先放着，等我看完再评。"
"看电影的alien","5","三分给剧情和演员，但是拍的有点土，而且也不像纪录片那样高大上"
"紫色翼痕","0","反正是我这几年觉得最好看的国产剧"
"孤泪黑天使","0","第一二集看还真符合现实，那些官啊，国企的看了后是觉得真实"
"人生海海","0","有些拖沓，不过权力倾轧确实还可以。"
"浮夸＂","0","旁白毁剧！"
"麻瓜","0","一个当官的 全家当官的啊..."
"Abramtsevo","0","中间没有前面节奏好了，比起大明王朝差多了。16集，追不动了。"
"胖如闪电","0","我朋友居然为这部剧差点和我吵起来，我不就是没吃他安利吗，差评"
"固体盐","0","还不错，比较现实。里面形形色色的官都有，不像以前的反贪剧，要么黑要么白。这部剧里有老谋深算的，有一心想往上爬的，有想做出成绩的，有升不上去混日子的，还有不希望出事想大事化小的。演员的演技都不错~"
"王进","0","碉堡了！！！"
"人于点点","9","几个老戏骨飙戏的感觉很棒，剧情也设计的有些悬疑在里面，到底是谁给丁市长通风报信的？侯大大好不容易演一个反派，演的太好了，可惜只出两集!陆毅倒不是演技不好，只是对手都演的太好了!"
"稍安勿躁","0","真正对钱有了概念……检察院不能和地区行政划分，权利重叠，双层领导。真是误事……里面官员饰演都很到位。"
"空色","2","“赵处长”侯勇和“高玉良书记”张治坚是出色的（btw《大明王朝》的演员个个顶配，从严世藩到书记，恍如隔世）。陈岩石已经预订今年的最佳男配角奖了吧，就不多夸了。"
"KarenNakajima","0","不知道为什么这类题材的剧很久没有出现在我们视野中了，记得小时候很多这类剧，每次都跟爸妈一起看得津津有味。好在等了这些年，终于等来了一部人民的名义。题材、剧情、演技都很值得赞扬，当然也有一些小缺点，但不影响这是一部好剧。"
"悠理舞芯","0","情节有趣，演员到位，国产剧还是可以拍的不恶心人的，赞。从来没见过那么钱，长见识了。"
"公虾米","0","就是好看"
"王懒言","2","陪体制内的爱人边吃饭边看了两集，假如陆毅这个人物的深度，在接下来的情节中不能得到发展的话，那真是件令人尴尬的事。但至少从前两集来看，这个伟光正的角色已经发育得足够好，可以成为体制内的学习榜样了？"
"总有刁民想害朕","0","侯勇老师不愧是戏骨，把人物给演活了，但是陆毅真的适合这部剧吗？还有就是节奏能不能快点啊，虽然中国官场很拖沓，但是你这12级了，一个贪官都没抓到。。。。"
"恩","0","题材、剧情、演技都挺好，特别是老戏骨的演技，完全是净化眼球啊。但是，剪辑是个什么鬼，看的人一抽一抽的，完全影响观感！陆毅演技也还好，就是和老戏骨放在一起有种满屏的尴尬，估计是近几年垃圾戏演多了，当年《永不瞑目》的灵气都快去肥韭菜了。还有郑西坡的儿子要不要这么多戏份，影响整体节奏啊"
"薛定猫的谔","1","群众演员演技特烂 作为公安混过的 公检法胡说八道  三级警司这资历能混上副省级市局的大队长么？一线出警执勤穿常服（礼仪制服）？麻烦尊重一下公安局啊？省厅正厅长警衔才一级警监？看不起省厅啊？各省厅长都是副总警监吧"
"王木木的碎碎念","0","剧情太慢 给侯勇点赞"
"红小小芋","0","听说被水军刷低分，太讨厌了，国产剧能出这样的题材就值五分，更何况有一众老戏骨，喜欢侯勇！"
"咕咕","0","康达书记"
"范王府的小格格","0","祁同伟这演员…虽是个配角，太不走了心了吧"
"Penny.Ung","0","加油 这是一个好的开始 希望越来越打开 将来全世界都看zg的作品"
"Buy-property","1","国产这种水平的剧太少了 官场表现挺接近"
"泱泱","0","首先是觉得集数太长了，如果能砍到40集那剧情会更紧凑。候勇的表现太棒了，真希望不转场就这么看他一直演下去。陆毅的表现不怎么满意，主要是选角上感觉不对，和之前黎明决战王千源差不多。剧里也还有其他逻辑问题，一些配角的戏份感觉于主线没什么作用，还演的不好。"
"溏心喵星雯","1","第一集我真以为侯勇演的是清官，结果却。很好看，都是老戏骨。"
"banbenlongma","1","噁心"
"macca","0","呵呵"
"Qionglin","0","这部剧能放，也是一个小小的进步"
"乌拉拉","0","打一星的黑子都是什么心态？"
"Tommy","0","此剧有毒，很久没看过如此现实的题材，拍的如此精彩的剧了，陈海被车撞的时候哭死，遍地都是老戏骨啊，飙戏看的好过瘾，墙裂推荐"
"我想你没有","0","- 好评，虽然算是洗脑神剧，不过比抗日神剧好态度，尺度也大多了。老班底演技一流，绝不是尴尬癌面瘫晚期耍帅装酷的所谓“小鲜肉”不能企及的！就是更新速度太慢了点，支持这样的佳作，希望更多的政府题材优秀电视剧！"
"疏淡寥烟","0","只有我一个人觉得陆毅很尴尬吗"
"惹你咸","0","天天追！好看！"
