"字段1","字段4","字段5"
"红马甲。","2","前两集我真的觉得，侯勇演得很好，比陆毅好，只能说是相形见绌，而非拉踩。这部剧里的官员真的是到处官腔、滴水不漏，很讨厌。才看了三集，很感兴趣。个人，勿喷。"
"昭梦飘飞","0","日常五星！"
"杜豆豆","5","终于我还是看了大豆瓣的最终剧透，只能说领导做得越大，身体越好啊。。。。"
"Solosoul","4","作为一名老党员，真心感概这是一部正能量的黑马好剧"
"YvonneKeh","0","不可说"
"香菇少女","0","走进体制内部。看完小说就没有悬念了，不过当真是良心国剧。"
"风油精","3","好多钞票的啊，小官巨贪"
"进击的穿山甲","0","好看！！！！满分！！！"
"叉","3","演技台词尴尬到爆表 但是看一眼被实力圈粉"
"Don't cry","0","注水太多"
"鸭梨","14","黄毛太恶心了，败笔"
"天水碧","0","可以说是非常良心了，还有好考验智商。。。"
"tree ","2","一口气看完17集，好喜欢 dark.com 书记哇"
"-偏爱G","0","很不错啊！必须追更！"
"慕容雪","10","看了第一集，很带感。期待后续！"
"Willow","1","打一星的什么心态"
"夏天的海","4","垃圾营销，根本没豆瓣水军吹的那么好"
"新狂人","1","看了前面几集，感觉还不错，陆毅有些奶油味，再粗狂一些可能更好，候勇演的炉火纯青，把一个可怜可悲又可叹的小处长演的活灵活现，柯蓝一股熟女的样子，有味道，几个老戏骨不用说了，很精彩。剧情直指腐败问题，尺度还可以，把中国官场、商场的许多生态场景呈现给大家，相当真实，呵呵。"
"困兽","0","尺度挺大，剧中处处可见对官场黑暗面的揭露。一众戏骨飙戏赏心悦目。但节奏太平，说教无聊，缺乏实质。一些生活场景戏拍的太敷衍，台词也很尴尬。如果你不是谁谁儿子，谁谁老同学，谁谁旧友，谁谁学生，中国官场你挤不进去。"
"琅琊榜","0","打一星的什么鬼，这部绝对的良心剧"
"Yuki_Yuki","0","这剧真的是被营销一手炒出来的，并没有那么好看"
"呵呵嗒啦卡","0","就冲着一堆老戏骨，也得五星。这年头连认真演戏都难得，唉"
"动能武器开发部","2","袁绍你怎么跑美国去了"
"鱼飞若水","0","这些演员简直了，功力深厚啊，，而且尺度确实前所未见，，看预告陈海是死了还是重伤啊，，，"
"云鲸歌","2","很好看。感觉全是老狐狸，满满的都是戏啊。陆毅过于正派了，像陈岩石这样的老一辈说有着坚定的革命信仰我相信，那是真的正派，侯大处长一点都不收礼，连孩子收个溜溜球就嚷嚷半天，不太真。"
"猫木","5","四星预定，前两集还原了中国特有的官产气质，剪辑可以更凌厉些，侯勇老师的表演让人挪不开眼，演技好到他哭着说我一分钱都不敢花的时候居然跟着心疼了…"
"十君","0","好剧再现！请勿错过！感谢所有工作人员！看得太过瘾了。老戏骨们真的太强了！！！这才叫演技！！！"
"P","0","千算万算忘了老天还有一算"
"XXL码宋慧乔","0","剧情其实还不错。然鹅里面要不要把每一位清官都装饰的这么富有生活羞耻小情趣。。看的好尴尬。。特别立字据欠贪官一窝。。看的我老脸一红。。我还是纯粹的爷们。。"
"大碗饭","7","前两集可看， 拖沓"
"一生","7","达康书记你要好好的"
"starry night","15","感觉注水情节太多，核心情节值八分到九分，注水情节太多，烦"
"大雅久不作","0","一边看一边傻笑，特别得趣。哦，不过，陆毅还是很出戏，不造是编剧人设有问题还是陆毅诠释有问题，总之就是不搭，几个年轻人也一言难尽。"
"乡秀树","0","哈 哈 哈"
"苍穹ぷ鸢鹞","0","打老虎，拍苍蝇，海外猎狐，中纪委自查，这几年不是喊口号不惜自曝不足从上至下整顿从电视剧中也是能反应出来一二的，也展现出官场内外的文化，节奏感确实有一定问题如果缩减成30集应该会好很多，但这部电视剧属于我们也需要这部电视剧，有自我革新的能力，远比推翻更好！"
"小梁哥哥","0","好吓人啊，来个一星。打五星的脑残们现实中真跟检察院的打过交道吗？"
"NinianYann","0","这是迈出了国内电视剧的一大步啊！"
"Yeah","2","太好看了，太给力了！！！"
"哦哦哦","0","九分，生活线略生硬，官场线辛辣真实最讽刺的故事就是生活。"
"弓羽飞","0","很写实，有突破。除前两集以外的侯局，其他人物有深度，融合了现代网络、信息、媒体等因素。有点问题就是贪官没有与时俱进，想法简单粗暴，没有城府，一看便知。"
"劳布斯","1","才看到第六集，惊心动魄。当然最终还是伟光正"
"爱有天意","0","那些打一星的，不是脑子有问题，就是心理有问题"
"樱桃炸弹","26","打一分的是对国产剧要求过高了吧 装逼装惯收不回来了"
"阿衍","2","我就想知道，谁才是贪官！！！"
"牙刷哟","0","留一星向纸牌屋学习的进步空间，留一星给逻辑引导混乱(不断会腐败的岗位到底是人的问题还是监督制度漏洞的问题，剧中反正只得出是人的问题)，加一星给广电，终于知道堵不如疏，换领导了？"
"大风车","2","一口气看了三集，我不懂政治但是感觉很真实的反映了中国的传统社会，中国的行为方式，应该很贴近官商生态了。相比美剧的直白露骨高调，中国式的厚黑更能让人感同身受。"
"飞妖","3","还行"
"恶魔的呼唤","0","恶心的YY片太假，本应该打3星平均一下分数"
"xiaohehe","1","吴刚演的李达康真有意思！"
"sayurioo8","0","给予他反腐的意义 剧情还是没有琅琊榜精彩"
"国民王女士㍿","3","打开尺度，值得鼓励！"
"kobe","0","不敢看怕写不出观后感"
"是不是","0","好看 国产剧加油！"
"米仓家的小凉子","8","守护达康书记GDP"
"魏晋遗民","8","没给国产电视剧打过分，这是第一部。"
"阿梁","0","强烈安利一部国产良心反腐剧，大早上7点起来追剧。"
"子虚","0","1星"
"一丈青","5","剧情不错，商业元素饱满，就是有时候说教味也上来就想跳掉Ps:看到第六集完"
"柚子","0","都是老戏骨演的，每晚都追直播！陆毅演的很好啊！不知道那些说他演的不好的是觉得那里来的优越感，而且靳东也蛮脸大的，这部剧就是指定陆毅拍的啊！这个时候来倒贴真是无语哦！还有靳东粉丝别再豆油我了，演什么都是明楼，好好磨练演技再来说吧！支持这部剧！"
"陈陈陈","0","说“恶心”的那位，求你别看！"
"Miro_","2","这种片虽然分数肯定会很高但真的好好看啊"
"长衫造纸农","0","哪个大学生电影社的社员拿着摄像机固定拍摄的吧，镜头表现力=0，五分钟弃剧。一星送给水军和营销黑幕，真让人反胃。"
"霍青桐","0","说是中国版纸牌屋真的过誉了，只能说题材不错，政治底线还算放松，制作水平只是正常水准吧。"
"qq7232753","0","听说有水军来拉1分了"
"Olivend","0","就凭这份勇气，就已经甩开其他电视剧10条街的距离！何况其他～"
"阿颠","0","总有种要高开低走的感觉 先打四星吧…追到现在总觉得没刚开始好看了 虽然才五分之一都不到（。挺好看一剧啊 千万别烂尾"
"我是当当","0","还真的挺好看的，真的写实"
"一支禾","1","赵处长演的真好！陆毅能不能不要出场"
"伊川","0","我喜欢陈海和他同事他爸爸还有他爸的朋友！！！"
"无名无幸","0","确实不错"
"澄南","0","其实看的不是反腐，而是中国官员和政坛的政治生态。广大群众也别太吹毛求疵，毕竟能够有这样一部作品，留给后人看看现在这个时代的政坛模样，也是一种贡献。其实几千年来不外如此，中国的政治从来都是堵上身家性命，你死我活的斗争。"
"玛丽莲·神童","0","里面的台词贫的部分尴尬症都犯了，而且都是一个套路"
"冉微念","1","谜之普法栏目剧feel，而且还有字正腔圆的背景音旁白……"
"JAN","4","看完感觉五星红旗的颜色愈发鲜艳了我背过的政治书更加栩栩如生了（我措辞不好 反正是五星的剧没毛病！）"
"叶月娴","14","刚开始看着挺不错，但是后面剧情有点拖拉了，看陆毅不可一世的模样有点格格不入"
"笨笨笨，，小孩","21","一星太多，也是够了  他们的欣赏水平得多高"
"万先生","0","还行，演技好，剧情比较好，就是节奏有些慢。"
"杨过儿","0","必须顶，不能让劣币驱逐良币"
"沐倩","0","因为陆毅看的，结果彻底陷进去了，真的良心剧"
"naonao","2","一口气看了12集，好看"
"咪将","1","其实没有想象得好看，不过不是演员的问题，是编剧的锅。有点儿乱，几条线并行得不好。这剧的宣发应该死全家。"
"春空千鹤若幻梦0","0","还行 强行宣传实在恶心 受不了 就这个捧得跟什么似得 都没看过好剧吗 感觉挺可悲的 90年代的电视剧演技几乎是必备的 剧本也大都比较考究 弄到现在整成这样 一部合格还不错的电视剧当宝 哎"
"who's 劳人?","5","我对不起国家 对不起党 看着那一张张老干部们的脸 硬是脸盲…… 是我政治觉悟低，里面保护人民群众利益的桥段，也不明白到底是对的还是错的，总觉得陈老爷子哪里有问题……"
"橙子","2","看比看小鲜肉演的有意思。有情节，有故事，看多了电视剧里的整容脸，这里面的也有，没那么多，毕竟女演员还是很少的。不喜欢那个郑胜利和他的小女友，一个导演莫名给自己加了那么多的戏，看着真乱。还有就是一会讲这个几句，一会切换那个场景几句，来回切换看着好累，还不如一个讲完了再讲另一个。"
"就喜欢一个人玩","5","陆毅怎么演什么都那么讨厌呢 一副正义凛然居高临下的样子"
"岛屿云烟","0","剪辑太烂，不晓得他这样剪目的是啥。不过话说，这种题材真的是前所未有的，剧情没啥硬伤，尺度也大，我很感兴趣，也很喜欢。今年追的第一部国产剧。"
"纵火","2","看了两集，歪日，贼鸡儿好看"
"酒红色西装","2","好久没出这种类型的电视剧了，昨天看了一集，全员演技在线，那个处长住着小房子，上班骑电动车，每月给农村的妈300元，还有那个支开司机伪装逃跑的管规划的官，都有真实事件的影子，节奏有点慢，但是部吸引人的好剧。（呵呵营销的反感）"
"地道战的田薯","2","看完第一集 觉得还不错但是后来的看着....就很传统了...节奏也拖沓起来...减星吧唉"
"河淙与清风","0","觉得真是一部剧情特别棒演技炸裂的好剧，影视有这样的开始真好。"
"六便士","6","超好看！感觉有点黑色幽默！简直官场现形记！继续追现在五星！"
"chx无名","0","官场的生态和规则，刻画地入木三分"
"Oueng","0","岁数大了 开始看这种电视剧了 之前看打铁还需自身硬的时候就有过这种感觉"
"京都民工","0","这个尺度，我给五星，只不过很多地方有点儿拖拉"
"米花花","1","在老妈的反复安利下看了  感觉节奏还不错啊"
"小叶儿","3","一颗星减給陆毅，完全不适合做演员，好无表演天分。半颗星减给侯亮平的媳妇，因为我太讨厌这种面无表情瞪着个灯泡眼的绿茶娘们儿了。半颗星加给侯勇，演的太真了，如果不是陆毅在我还以为是纪录片。"
"心远篱人","4","需要更多此类电视剧电影"
"格外耀眼","0","演员阵容 差强人意 节奏慢"
"梦想家星光","0","陆毅饰演的侯亮平是一个没有背景的符号化的人物 像孙猴子一样是石头缝里蹦出来他是为了人民代言的一只孙猴子 就是这样稍微轻佻的个性 并不是演技问题"
"✨小宝贝✨","12","是吧，现在还真是只有这些老戏骨的戏能看！"
"glory825","0","对于国产剧已经是一个很大的进步了，难得的没见到流量小生，花旦过来搅局，真是一股清流"
"rayvic","0","国剧通病：啰嗦拖沓，强行搞笑。一星是给恶心的宣传"
"左半球","0","如果情节不拖沓那就完美了"
"小吴想去大理","0","必须满分！看老戏骨们飙戏太爽了！"
"北方 知寒","5","一位省公安厅长说，我是从娘胎来，往坟墓里去"
"莹sama","8","没有人觉得李达康像老十岁的甄子丹吗？"
"南町野猫","0","只能说剧情越来越拖，还有那个林画画真像我认识的一个傻逼鸡"
"大西洋的地盘","0","虽然我们处在黑暗中，但能拍出来就是光明的。"
"方羌羌","0","请垃圾摄影师原地爆炸 真是坏了一锅粥"
".COM","0","每一集都好感动还有真的想把打一星的人和吹孔笙的人都特么举报了。还有说陆毅演技问题的，好吧，这个确实是把陆毅放在一堆演技高超的人里面确实有点不怎么突出，但是至少不出戏吧，第二集他看到冰箱里的钱以及侯勇老师的深刻演技下，愤怒到眼睛都红了，所以不要那么挑剔了。要挑剔就点名cob那类"
"声色、蒹葭","0","这部剧能放出来已经很好了。对于贪这种事大家都心知肚明，清官都不一定清，只是贪多贪少的问题。"
"小西米","1","里面说出好多大实话，和好多我最讨厌的说话靠猜。现实啊"
"二三事","1","好剧！某些地方能再深探一些就好了，某些地方很僵硬，陆毅的演技不大好，但仍然是好剧。"
"老特拉福德","0","剧情还是可以 说教过多，过头了"
"焦虑症先生","0","第一次看国产现代剧这么入迷，内心戏很足。感觉今年因为韩国检察官查干政门和这部电视剧报检院的人要突破天际了~"
"璇","0","一群男人老戏骨飙戏还是挺有看头的"
"一朵药片","0","整体还可以，这样的题材挺抓人眼球的，但是部分情节太拖了，再紧凑一些才合理。"
"岁月 光影","0","不要动不动就代表人民的名义"
"天秤座的胖子莹","0","只要不看网上路透一直猜倒是很有趣，终于有部剧正视观众的智商也是不错的，戏骨之间的飚戏很过瘾但是剧集的女演员们选的不太好，还有就是剧情发展到中断有注水的嫌疑，中国正剧总喜欢用几十集讲一个案子难免拖拉"
"castilla","15","这部剧从台词到道具80%就是官场还原，小清新们应该是美剧看多了。如果你想了解中国政治生态，那负责任的告诉你，和这部剧差不多。如果你想看艺术性，可能你可以挑出槽点。体制外的人你就当科普看看你永远接触不到的事情便好。"
"说好的世界尽头","0","应该对国产电视剧有信心的……"
"绾绾Joey","10","陆毅穿检察官制服太帅了来看的！还不错，先打个三星～"
"木头人_Cho","0","正剧的典范"
"木棉同学","0","四星给老戏骨们，还有一星给陆毅一脸正气的颜值！和他包青天的形象无限契合，是我的错觉？"
"M_M","0","国产好剧 略假"
"春两袖","2","能说我今天一天，就追了这一部剧吗"
"微微大人","7","此剧贴近真实反应中国政治生态的现状，说话的艺术，婉转，台词精彩，小官耀武扬威，见到上级瞬间怂样。饭局酒局上你来我往，互吹互捧。老戏骨们的演技简直不要太棒，各自演好各自角色的性格，或圆滑世故，或直来直往，或绵里藏针，不露声色。难得有如此好剧。"
"七末","5","能在一集内抓住观众眼球的剧集，近年不多了，人民的名义必须推荐！"
"颦儿","0","刚看了七集，听过瘾的，对一些事情理解加深了，也理解了一些不曾理解的事情。"
"warriors","0","很多年不看国产剧，看了两集，不想看了。仍然是主旋律，陆毅的说教很烦人。人物日常对话总有北京话的那股塑料味，一套一套的，爱贫，又没创意，现实中人这么说话吗。还有官场语言那种随时严肃端正的范儿我受不了。人物性格设定非黑即白的样板戏我觉得爸妈那个年代的人可能会喜欢。"
"研磨爱","1","在这里,《人民的名义》剧组再次郑重警告一切不法分子,《人民的名义》不仅是广大人民群众极其喜欢的一部十分难得的现实题材反腐剧,也是多家机关单位影视机构共同完成的一项重大政治任务,广大人民群众和有关制片方绝不会允许被恶意抹黑诋毁,我们将利用一切合法手段全面启动预警机制,检测那些利用水军诋毁"
"Nein zedd","0","4.0，还可以，就是剧情有些拖。再看看吧"
"哀木涕","0","神剧，就是陆毅太正直了。。悠悠球那个真的逗乐我了，真的这就是社会"
"中二已痊愈","0","这部戏有价值的地方在于几条线索背后的关照，我最欣赏的一部分是大风厂改制。对官场的反映最精彩的在于对群众路线的重提和对共产党干部培养方式的刻画。至于官员个人形象塑造什么的，并不觉得达康书记育良书记的形象有多精彩。是一部现实主义的剧，能直面问题，但是现代剧也就注定最后会丢失很多。"
"秌","0","就凭这个尺度就应该给满分"
"renee","0","有点约美剧的套路"
"翻滚吧毕业君","17","还不错。但我捋了下人物关系：高官的学生～高官。高官的子女～高官。高官的发小～巨商。高官的侄女～巨商。高官的老婆～银行长。。《人民的民义》人民没看到，只看到官商阶级窝里斗了"
"桦23","0","节奏不错"
"一个神奇","0","之前已经对浮躁的国产剧已经丧失了信心，上一部国产剧看的时候，还是在四年前大学的时候，看的是也是由同名小说改编的电视剧《青瓷》。这《人民的名义》尺度确实好大，不再回避现实反腐中见不得人的细节。层层揭露。希望以后多出好剧，再出几部大压力的反腐剧，而不要总是播那浮夸演技的电视剧，辣眼睛"
"是茶茶呀","2","紧凑，真实，汇报与对话开会冠冕堂皇，瞻前顾后太真实了！"
"子皿","5","大尺度，大手笔，大演技！"
"⑨刀一闪喵喵喵","2","别以为敢拍就是啥牛逼的事儿，无脑吹5星的都特么长点儿眼睛，最高检的好伐？广电再牛逼也就是长工，这后面才是真赵……虽然也没什么用就是了。所以说能拍算什么牛逼？有本事你让文艺工作者自己来创作来拍？开封府衙前面喊包青天是没有用的，你得让民众在乡间喊，才行。"
"even","6","大家都看得太快啦，我才看到8，不了解公检法的人觉得拍得很好，不过里面有几个可有可无的人，比如郑西坡他儿子，还有林某某和她男朋友"
"懵July","0","一帮子老戏骨对戏的感觉真的看着太爽了，陈海出车祸，陈岩石在医院走廊的那段看哭了_(:з」∠)_ 第二集里那个下车就腿软演的也超好。其它的年轻人感觉就是有点跟不上，侯亮平有些台词升华的太过明显了。不过瑕不掩瑜，还是值得一看的好作品。"
"faily tale","0","我们是用比较来的。。。。比较出来的结果是全五星"
"圖.","21","光看到片头大量实力派演员就燃 被侯勇的三阶段崩溃过程折服 凯丽老师太拘了 特别绷着 感觉随时都要站起来对着女婿发飙的跳戏感哈哈"
"LiuVv","0","作为上星电视剧，这个尺度我真的服气。但是陆毅真的太尴尬了，他一出现我就出戏。有关他的友情戏、亲情戏感觉都像硬要他们凑在一起，大家都不情不愿的样子；有其他人不断地提他像猴儿一样，也是很醉。一定要表现他猴一样的形象，学学刘星、余罪不就很好吗，反复提却没有具体情节表现，巨奇怪啊。"
"十里芳草","12","还是人搞人人整人人治人，勉勉强强不能看"
"守鹤","7","很多细节经不起推敲 特地来北京交接工作 一个卷宗交接就是随便放桌子上然后就可以去吃饭了 另外陆毅这个学是白特么上了"
"逆骨。","5","尺度很大，挡不住台词尴尬，中国式的商贾和官僚主义，响应政策的反腐题材。"
"小角落","2","扣除一星，因为无关紧要的郑乾"
"灞波儿奔","0","当代的官场现形记"
"Thinker","12","想知道有多少人被一墙壁、一大床、一冰箱的人民币震撼了。国之蠹虫，此时不除，更待何时！"
"小强","3","这力度，这铺垫，这现实感必须大赞，希望最后不是一个歌功颂德的结尾"
"低调小白兔","0","为什么有人觉得是高开低走，明明是越来越精彩好吗？"
"苏璟","1","演员题材各给两颗星"
"aut","0","进步了很多的国产剧，但还是有一些老毛病。不知道郑西坡父子有何重要，反感其子"
"小闹钟","6","有瑕疵，但死命支持这类新的题材！不要再拍谍战抗日古装了"
"Charlotte","0","就冲党性这么强，也得五星！社会主义存在问题，但是我爱我们现在的这个社会，慢慢都会好起来~陆毅演技还可以啊，哪里被吊打？！那个郑乾和宝宝能剪掉好？真的很讨厌"
"林小雨","0","不懂政治，很多细节还得靠人科普才懂。"
"异数","1","陆毅应该是我喜欢的男明星最久的一个。都是老司机啊，满是套路。演的可真是好啊，老戏骨！"
"舞低杨柳楼心月","3","这么好的剧不打五星对不起自己"
"悠悠","0","片子很好看，但我更希望是在释放大力反腐的信号。。因为现实比剧里严重的多，我几乎没见过比较清明的时期"
"drizzle","25","主旋律，根红苗正都好人，监察厅男主一脸正气，真的恶心，官腔一大堆，你看到的只是政府想告诉你的"
"时光","7","题材和演技一流，没的说，在目前国产电视剧一片大烂的背景下这部剧已经不错了。但是看了几集后剧情 太拖沓，没有出现高智商和强战斗力的对弈！~~~~~"
"cut","0","讲真 陆毅真的……他不适合这个剧 估计胡歌演好多了"
"Junjin的老婆","6","围观陆毅演技被吊打！"
"黑色信封","3","什么时候才能再有像《潜伏》一样好的主流正剧呢？"
"阿言","0","相当不错,紧凑,正能量也能让人不反感"
"电影人生","1","棒"
"tintin","1","在东大拍的耶，可惜情节有些拖沓了 ，把能讲成五星的故事讲成了三星，不过里面那些老演员演的真好。"
"bitsy cosmos","6","哎，为拔高分贡献一丁点力气吧~ 整个评分下降的过程就是 木秀于林 风必摧之"
"寻找无双","0","是不是过誉了啊。制作也不算精良，拖拖拉拉的。"
"晨风","0","挺真实，挺好看，不只是有反腐的噱头"
"冬冬","0","很精彩,这尺度是突破"
"chichi","0","老戏骨飙戏实在是好看啊！唯一的不足是郑乾那家伙的戏怎么这么多"
"白夜","0","片名差评"
"刘玉婷","2","不错！！！"
"我很王力宏","1","看看这些演员的演技，那些有流量却无丝毫质量的垃圾鲜肉们（李易峰 吴亦凡那些**）不觉得惭愧吗？"
"Skye","4","作为一个见过一小部分官场生活的人，觉得很多内容还是很中国实际情景的，但是拍摄手段，剧本衔接，剪辑等等还是有很多地方有点傻，让人出戏..."
"Henry李","0","绝对的五星好评，各个都是实力派啊，第一集的侯勇就直接抓住眼球了"
"一个杀手","4","陆毅给整个人民拖后腿了。"
"陶泉霖","0","前天看到后半夜，就是单纯的好奇心，这剧确实不错，都是老戏骨，真心比现在的小鲜肉，动不动就是上千万的片酬，比一部电影的成本还高。。"
"沐阳Amigo","0","不说别的，就凭这股国产剧清流也要给六星吧。"
"xxxadbc","0","老戏骨超赞,剧情有点拖沓，Bug 也多，压缩到三十集正好。"
"遁身远迹","0","一切为了达康"
"Sunday27","0","陆毅演技负分"
"胶光片影","0","陆毅演技扣一星…"
"喵小姐","0","三集弃"
"灼灼春园","0","好剧，情节拖沓了些。"
"翀翃羽","0","这部剧非常震撼，对于我们年轻一代的人意义颇深！里面的每位演员都演技精湛，特别喜欢里面的达康书记--吴刚，希望我们年轻人可以多学习！但这部剧美中不足的地方，就是郑胜利这个角色，但目前作为今年最好的剧，5颗星"
"____王先森づ","0","看了一下电视剧毕竟是电视剧、和现实还是有差距的。细节就不说了、大家都知道、我无需多言。还有我不知道剧中的郑胜利到底是什么J8不知道导演用意何在，这应该就是“反腐神剧”吧！"
"水匡","0","想说的太多，短评不够发挥，先表白达康书记!!!"
"喜欢不要来由","0","一般般"
"鸡小豪","0","被英美剧养叼了胃口早就看不进去国产剧的我，因为看了一眼就深深被吸引不可自拔了。虽然五星略高但平衡下一二星正好。感觉这部剧最大的作用就是在打某些明星演员影帝影后的脸，真响啊！真想知道他们脸疼不"
"桃源故人","0","有周梅森做编剧，文本上过关，非常棒。更满意的是一群戏骨演技一直在线。不满意的一星是剪辑略混乱，还有就是为嘛检察院都是正面人物？第一集最高检抓人略出戏，反腐主要靠中纪委好嘛！"
"ally","0","真实"
