"字段1","字段4","字段5"
"没办法小姐","17","打一分的安的什么心！果断给五星平衡"
"321321a","2","说玷污警察的，真别太玻璃心，那以后谁也别骂抗日神剧了。不指名道姓，有的人就是因为丑恶面目被揭露，才恼羞成怒。"
"左耳之林","0","越往后剧情越拖沓，尤其是黄毛父子，台词剧情完全就是毫无意义的，和主线没任何关联。而且剧情推进太缓慢了，常常一个对话场景能演一集，镜头切换太频繁，说一半，切一半，让观众看的很累，看的云里雾里。这样下去，开头两集侯勇演技推上去的评分早晚被败光！"
"花小蕊","2","剧情不错，希望不要被剪完了。出了陆毅跟柯蓝，其他演员都很棒。"
"楚小白","9","支持多拍一些这样接地气的揭露现实的剧。表白剧里的一众老戏骨，看你们彪戏太过瘾了"
"Miss Panda","4","很赞！"
"城南屠狗客","0","俺也是小粉红"
"慕灵珊'","8","1、题材值得鼓励，单独作为一部剧看，它显然拍得不如同类型的韩国影视作品。2、虽有老戏骨加持，但愈发衬得青年演员的演技之拙劣，演的痕迹太重了。3、旁白听得尴尬症都犯了，你以为披着反腐的外衣，就可以从矮挫穷变身高富帅吗？不过是国产剧很少出这种大尺度题材，观众看得新鲜罢了"
"athos","0","剧是个好剧，但热搜买的太多，引起吃瓜群众反感。特地来打个3星。"
"黑不拉多","0","尺度有进步，不过仍旧是隔靴搔痒，不说三权分立，至少司法独立也好嘛。"
"Valeria✿","6","一水耀眼的卡司里挑了個菜雞做主演，套路似曾相識。"
"蓝飏","10","自从看了贪官的纪录片，又看了这部剧，简直了……公知们快来看看啊"
"橘子粥头_豆瓣","7","讲真，上次看的完整的电视剧还是N年前的亮剑！一天，追了十集这剧，尺度真大，题材，演技，没得说，国产政治剧史无前例的精彩。"
"wanderfish","9","剧中很多台词非常辛辣、直接，就很值得点赞。至少，敢说真话了"
"栗子侠","3","达康的双眼皮我来守护！"
"萧瑟","3","正剧、精品剧、良心剧，唯有此剧当之无愧！"
"douon","15","啰里啰嗦的真看不下去"
"后仰跳楼","8","醍醐灌顶"
"查理叔叔","1","还没有看，大约不会看。"
"gezi","3","陆毅演技不是差，而是根本就被比下去了。陆毅的演技不是低分党给差评的理由"
"叮当馒","8","看到第十集实在看不下去了，感觉导演编剧用力过度把演员都浪费了。就陆亦可这三商下线的劲儿，陈海能看上他一定是车祸后遗症脑子有包啊…想玩双主线并进也得搭的上啊，没人觉得是硬噶么，尴尬癌都要犯了啊…那个黄毛是什么鬼，那是贴近年轻人么，是丑化年轻人吧。三星给老戏骨们使本剧勉强还能看得下去"
"小粉红克星","10","不多说了，本来的一部6分的剧，小粉红们硬要说9分就过分了，给一星吧，后面的剧情越看越扯淡。"
"刘健一","3","场景切换太乱 台词有些水 年轻演员也稍微显差 bug还挺多的 但不失为好剧"
"道是无晴","3","二流上层的败坏引起了一流的恐惧，于是一流就想收拾一下手下们。用权力去遏制权力是马主义者最大的悖论，马曾经说过是要分权的。他曾预见性的说过，他不是马主义者。"
"波罗僧","9","（呵呵，我就是那个输在起跑线上的人。）陆毅这个人设太假，演技为0，陆亦可演的太不接地气，总是一副洋洋得意的样子，是洋洋得意，优越感，趾高气昂，不是简单的自信。"
"Radiocore","21","不就是个一般的剧，至于捧上天？屎吃多了偶尔吃顿狗粮都觉得香，感动得泪流满面。骨子里的奴性。就想问问光腚总局为什么对这剧不审查？看来央妈亲自打过招呼一路绿灯哦。那对民间的自由创作为什么要双标？阉割别人，成全自己。真恶芯。（又被删评论了哦，科科）"
"Sisynaja","0","台词真的太讲究！可惜剪辑的功力欠佳，另外建议删掉黄毛和他女朋友的戏份，这部剧过审的信号意义大于片子本身"
"老韩","1","四星水平，多一星给突破，鼓励一下"
"觉非","8","还不错的国产剧，开头侯勇的表演真的扎心了，老戏骨整体都很好，但台词太正了，陆毅两口子在一起聊天都得背党章，觉悟太高！毛毛虫，林华华浮夸太呱噪，忍不住快进。总体还不错，但也有瑕疵"
"K.Z","22","剧情真的太拖沓。"
"孤僻的关耳君","9","全剧卖点只在涉及贪腐的阶层之高除此，剪辑一塌糊涂，演员表演也因无法还原国家级官员的姿态而总显得别扭。恰如葛优所说，演小人物他可以观察接触模仿，但是演宰相、大官，他看不见摸不着更学不了，自然无法演得好。戏骨已经尽力，但人物表演依然差劲。"
"多多里","7","好看的电视剧当然推崇一下，节奏紧张、全员演技（陆先生尽力了）上线，不过怎么我看一些一星评价，怎么那么生气？一个电视剧8分以上你为啥要气的要死哦，不懂你们反骨仔"
"八卦人士","4","很精彩啊"
"纯良痴汉","0","屁民的名义！"
"ThinkDifferent","8","为陆毅的演技减一星，全程尴尬"
"gumi天使prpr","3","前两集好看，后面比较水"
"洛水之渊","1","这剧优缺点明显能拍成就不容易了，难得废寝忘食的半夜追"
"林小风","8","剧情很好看，不过实在是有点拖沓，还有动不动的人物内心独白，感觉是对演员演技和观众智商的嘲讽呢。。。还有时不时尴尬的正能量配乐，还是能瞄出国产剧的端倪。。拍成15集会是一部佳作"
"有鹿来","9","忍不住打五分，贪官入木三分，领导调研审问下属时真的是还原了，只不过平时骂的更可怕。还有机关办公场所，领导办公室面积和摆放，秘书跟在领导后面收笔记本拿杯子这种细节做的都很到位，难得这么写实了。"
"老妖","4","看了三集没看了。挺好的。不过我还是看不下去。"
"柏树青青","0","我只想说，打着反腐的旗号，口中高喊正义的人，你自己是否会贪，贪不在个人的品质，而在体制文化的缺陷。现在还有那么多人幻想英雄主义，寄托个人品质、道德来维护正义，太天真！"
"弗路十四","0","我真的觉得人物设定得特别假...这是一个硬伤。"
"风寄雪","9","刚看了两集，好看，五星好评。希望后面别让我失望改分啊~~"
"税控AT","2","最好的反腐片，感谢老戏骨"
"I live to die","2","题材挺好，本来可能剧情挤掉拖时间的水分还可以，但是……表演太业余，秒出戏，人物塑造尴尬，镜头选择和剪辑效果较差。还不如后两部重案六组……可惜了……"
"无有财","1","瑕不掩瑜，尽管有些缺憾，仍不失为一部好作品。"
"弘与合欢","18","好看啊，老戏骨们的表演看着太舒服了，五星预备着。"
"拯救太空人","15","豆瓣用户对这部国产电视剧真是比球迷对国足都宽容 这玩意8.8 逗乐呢"
"Jonhanna","0","要说演技，还得是这群演话剧的！"
"cat","4","演技一个比一个棒，尺度大，话题度高。除了陆毅的角色，其他的都很难说，看个反腐剧，有了悬疑剧的感觉。有人踩陆毅的演技的人，真的无法理解，虽然跟其他老戏骨比。是嫩了一些，可比那些小鲜肉不知好了多少倍，至少不是靠配音演员演戏，而且由于人设和情景的问题，以后会越来越好的。"
"QQ","0","蒙太奇得莫名其妙，官场都是人精啊"
"小Q","1","近期看过最好的电视剧"
"玻璃芦苇","6","尺度颇大，演员演技都不错。不足是中间有几段注水严重"
"姜伯铭","13","看着挺好的一锅汤，闻着却起鸡皮疙瘩，用勺舀了舀，原来私货太多。"
"Валентина","3","光是这一水儿的演技派同台飚戏就值得好评。再加上特殊的题材和震撼的剧情，值得一看。"
"S","10","依旧是大段的感情铺垫和教育说词，在前几集就已经这么明显了。"
"晗月","0","确实挺不错的，看的还不够多，到时候多看几集再来评论"
"siebZehn","2","不敢说的讲出来，就还有救！官场厚黑学赤裸裸。唯一不喜欢就是打着人民的旗号。"
"Mo","0","提问 胡静(高小琴)的脸 肿么了???这小皮球 的身高 在同龄中偏高了哈...怪陆毅 的口音 听着好难受，怎么说话卷舌头的..说什么都是卷舌的...我嘞个去！"
"孤鸿野狗","13","周梅森过时了……整个剧的节奏和立意都不怎么上得了台面（跟陆毅赵子琪一起负分滚粗的水平）。有些细节不错，吴刚跟张志坚、吴刚跟丁海峰、丁海峰和柯蓝的对手戏挺萌挺耐看的。"
"艾越","7","如果天空总是黑暗的，那就摸黑生存；如果发出声音是危险的，那就保持沉默；如果自觉无力发光，那就蜷伏于墙角。 但不要习惯了黑暗就为黑暗辩护；也不要为自己的苟且而得意；不要嘲讽那些比自己更勇敢的人们。我们可以卑微如尘土，但不可扭曲如蛆虫。"
"柴郡猫","0","15集弃。。。越来越拖沓，真的好气！被剧透了大boss跟自己猜的一样，更不想看了。。。"
"halou","16","对白尴尬 剧情拖沓 基本不说人话 看似尺度大 其实是洗脑片"
"abnormal","17","赞誉过胜 我以为是几集一个案件 结果到了十四集还没破案 真的看不下去 对于我这个对中国政治和厚黑学完全不感兴趣的人来说看他们说话就心烦"
"七僷","1","看了一集，竟然还不错。"
"西米格","14","拍得不错啊。陆毅还是很适合演这种正剧的，终于接了部好片了。"
"凡凡凡妮莎","14","前几集很好，后面越来越拖，支线小青年们又聒噪戏份又多完全不知道在表达什么，陆毅演的太差各种尴尬，逻辑和剪辑也开始混乱，剧情没什么进展一个蔡成功来来回回拖了十几集都没个说法。我是爱到深处自然黑啊，明明开头那么好的电视剧这么早开始烂尾实在心痛啊。暂时三星但目测五十多集下来要改低"
"L-Dumbledore","4","特么好！"
"朱诺","8","看了五集，第一二集太精彩，越往后越啰嗦，有时一句话重复好几遍，不愿看下去了……"
"小圆迷妹","7","五星给侯勇老师演技炸裂！"
"NEVER4U","1","政治猎奇"
"Rin","0","看了四集。不错看，只是不是我的菜而已。"
"萧萧南浦","5","在一堆玛丽苏剧里，难能可贵，清新刚健。有人游离出戏，老戏骨的表演惊艳，总体大赞。电视剧太慢，我找来小说先读了。小说不如电视剧。"
"憧樓Melou","1","其实想给满分，但是一想到现实......这剧可以归为魔幻小说了吧。没办法，为了现实减一分！"
"ypapanti","4","豆瓣真的很分裂啊~"
"angelqi","8","唯一看过的跟现实政治沾边的剧就是《蜗居》了吧。现在的状态属于第一集看完意犹未尽又看第二遍、第三遍。"
"艾玛西","3","为什么看着这些官员间尔虞我诈的样子好好笑啊！"
"阳聪嘻嘻","0","虽然，依然是虚构的地名，好歹是个省了；最大的boss 不可能到党中央，但也高到了上调的前省委书记---封疆大吏；节奏依然不紧凑，许多台词稍嫌尴尬，可终于不是大IP了"
"奥斯卡的猫","3","感觉有点墨迹，到后面看着看着就溜号的我，一开始也是想好好看下去的啊！！！"
"秋山","9","如果能打六星就好了！！！现实可能很黑暗，但我们还是要心怀理想。脚踏阴沟，仰望星空。我相信等我们这一代，到了40/50岁的时候，中国会改变的。正直而又善良，刚正而不谄媚，那是三十年后。那是我们的年代，我身边的同学们，以及我自己。"
"你要的水花","4","还好这部反腐题材的电视剧有最高检保驾护航，不然保不齐能不能通过某局审查。里面好些人物都有原型，所以故事情节的逻辑性和可信度相当高，经得起反复琢磨。台词写得见仁见智，私以为里面年轻一辈的台词都一般，伟光正或者傻白甜的角色已经不时髦了。"
"告白气球噜啦噜","6","好久没看过这么过瘾的一部好剧了，本子好、制作好、演员好，看老戏骨飚戏真是享受，不禁感叹一句“这才是演员”！虽然陆毅在一堆老戏骨当中比较显弱，偶有几处台词出戏，但看到现在开始慢慢习惯他，他就是侯亮平！每天都追，很期待接下来的剧情，已深深迷上我们达康.com"
"月光之魂","1","谁在黑这部剧，让他用毛笔抄袭毛主席语录！"
"拜拜","11","某些吹自己良心剧的公司看看什么才是良心剧"
"Grace","3","期待跟原著一样精彩"
"独行疯狼","5","豆瓣分数掉的挺快啊，虽然有瑕疵，有些日常镜头过多拖剧情，但在人设关系上复杂多样，各演员演技在线，剧情又让人捉摸不透，瑕不掩瑜依然值得满分。"
"炸弹","8","老戏骨演技爆表，剧情虽然真实，但是发展有些缓慢，陆毅略显稚嫩，强烈要求写死侯亮平，把侯勇放出来，跟达康书记、高书记演对手戏"
"kokoiii","7","炸裂"
"失敗齋主","4","有真实，无思想，拖沓。"
"酸梅子红茶","3","我就看看哪家流量水军刷一星刷的这么起劲，五星没毛病"
"果果","11","看了两集直接弃剧，不知道有什么好吹捧的，伤残害命的贪官污吏会得到报应应该上个世纪五六十年代的梦。"
"bobo","10","尺度之大，作为常年和政府官员打交道的人来说，很真实，但实际上还是好人多。"
"有一天变成猪","14","有些人总喜欢与众不同 明明没看过 却只打一星"
"春暖花开","1","啪啪打脸；减一星是因为这剧太墨迹，7集弃"
"凹凹","5","节奏太慢"
"杨知寒","13","别拿这剧和大明比。叙事，台词，剪辑，差远了。"
"葵葵可可","5","五星先捧着"
"半岛铁盒的等待","0","有些部分很真实，无论是官话还是厚黑学都很到位，人物、剧情均属丰满；缺点是过分塑造出绝对的明暗面，台词政治口号化。官场难于战场。"
"大侠系着红领巾","9","听我朋友说，光店本来不让过的，但这剧是最高检拍的，拦不动。剧很好，虽然看到了很多黑幕，但也从此看到了希望。陆毅在一帮老戏骨中演技还是有待提高的。支持好剧。"
"温柔的小坏","3","在抠图成风的当下，这也算是一股清流吧。正面人物还是高大全的老套路，尤其是陆毅，不接地气啊！达康书记么么哒"
"盲匪","7","真正的神剧在于里面配角都是神，继大明王朝后的又一神剧"
"小小阿狸","6","此剧高开，政治戏比反腐戏精彩，每个人物的出身导致自身在事业上的野心和格局，说的话，做的动作，攀的关系，细节都非常有意思，话中有话，互相试探，没有绝对干净的好人，只有复杂的好人。但主角太过于脸谱化，一出来就知道伟光正！陆毅的演技太水了。"
"莉莉安","3","一群[演员]在演一部真正的剧湖南卫视，这次看到了一个大台担当"
"艾弗森的发带","6","无论剧情怎么样，这个题材和尺度就值这个分数！"
"阿D还在战斗中","1","说真的…不是尴尬和假，官场就是这样的，句句内涵，几个人互相捧，出了事情最该被抓的人抓不着，背锅的不少…"
"爱吃蛋糕的咪咪","11","感觉陆毅有点拖后腿，毕竟配角都是老戏骨"
"秦中亭","6","看了四集看不下去了，剧情拖沓、人物表演夸张、台词尴尬~"
"水鸟秧秧","8","这个片，和人民真没什么事儿啊"
"鱼麽麽儿","12","说实话目前只看到第六集，两星给开篇的侯勇，一星给该剧的尺度。猴子夫妻俩的戏都是快进，夫妻俩床头聊个天跟开党 会似的，即使是正剧也不能这样吧。"
"菠萝油宝少爷","4","头两集的节奏很好 可惜后来越来越掉链子……剪辑是个大败笔"
"Vermouth","13","因为遇见你总算是大结局了，感谢，太感谢了。"
"tiantian","2","果然神剧，人物有血有肉"
"sentimentalday","10","尺度是有点大，但是剧情太拖沓啦！"
"我做导演不为艺术只为潜规则","0","官场戏可以一看，但到各条支线生活戏就比较尴尬了，人物有鲜活的也有脸谱化的，到也反映了官场生态和官民间的割裂，检查院投拍的剧黑兄弟部门黑得丧心病狂"
"Irish Coffee","3","主旋律好剧，看老戏骨们演戏很过瘾。"
"黑面龙王","0","节奏太慢，看惯了美剧，这进度感觉无奈，三星。相对于其他垃圾小鲜肉演的，算是好的，加半星。黄毛这种主线无关的拖时间伎俩，扣半星，反正黄毛出来我就快进。没有传言的那么好，豆瓣评分肯定还会降点，只有黄毛戏份还那么多，降得还要更多。"
"枕梦","7","不为别的，能拍出来，拍到这种程度就觉得是一种进步。但是却不得不吐槽陆毅的演技，实在是不能让人获得一点认同感，很多时候他台词里流露的冷漠让人觉得他并没有理解角色甚至缺乏同理心。高玉良演得太赞了……orz，老戏骨们对每个角色的揣摩甚至弥补了一些情节逻辑上的硬伤。"
"叶落尽","4","不能免俗"
"行所在","2","陆毅是这个片子里的最大败笔"
"江雪宫城","0","我一见吴刚就想到了十月围城里面阿四的爹！！！演技一流！结果达康书记火了，哈哈哈～中国不是拍不出讽刺的电视剧，国家让拍就成。"
"在吃大苹果","1","满分"
"鲭","2","目测高育良书记是大boss。"
"公园笨龙","14","我就是来平衡下分数"
"鍵盤奇俠","2","良心剧"
"朝暮逢岁晚","1","太值得看了。"
"红辣椒","1","之前打了五星，看了几集后修改，太拖沓太套路了"
"在望","1","这两年国产剧质量开始回归"
"乐园鸟","0","很真实，要是早播出20年就好了，不过那时候还没有互联网"
"乌鸦殿下||神器·加藤鹰之手","0","电视剧比小说更有张力"
"淮","4","人民的纸牌屋！"
"莲渊","3","尺度真的好大。都这么多年了，陆毅的演技怎么还是这样，，，"
"Ana","6","没看完，但我为什么不能给一群会说台词的演员五星。达康、育良贡献了高水准表演，就连蔡成功、郑西坡都把我从尬戏阴影里解救了出来……陆毅被很多人严重低估。演技这个东西最怕比。"
"温翔","0","题材尺度大是一个看点，关键悬疑处理得很好，真看不出谁对谁错，谁在演戏谁是真高风亮节，剪辑是硬伤，多条线索并行，看得不是很过瘾。"
"婠颜","1","当一个国家允许黑暗面被展现时，说明它还是有希望的，它的执政党心里还是透亮的"
"J.F.","0","神剧看了第一第二集。"
"客舍青青柳色新","7","喜欢侯勇和达康书记~"
"鲸鱼的心跳声","0","网络上铺天盖地的宣传，心理预设，这戏盛名之下一定不符。好几个叫不上名的演员，演得确实好，开始没多久在办公室那女孩的戏，生生演成偶像剧的画风了。给司机一千块的时候，“廉洁必须从我做起”，这种手段的反讽真是让人不知说什么好，太低级了。给三星是还有期待，希望后边的戏没那么差。"
"妖孽横生","2","检察反腐最后一部巨制，国家监察委走起，没检察院啥戏份了～老戏骨们吊打陆毅等一干年轻主演……虽然略为浮夸,但是也不容易了，刮骨疗毒～道具略假……一星喂给那个亿的道具rmb"
"gillbert","1","达康书记！！！超苏，颜正腿长条顺走路带风(*¯︶¯*)"
"cuicuipopo","4","前几集还不错，后来节奏慢了，啰嗦的地方，无意义的地方太多，总的来说改编的不错，比书好……"
"程大官人","1","打个五星走一波，看完再说"
"雨过终究天晴","7","卧槽看了四集看的欲罢不能啊，天知道我这是20多年来第一次看这种题材的电视剧，真心精彩，一定要给编剧加鸡腿~"
"上山弱水","20","请不要以我的的名义，不要随便代表我"
"☆木木蓝枫☆","5","精彩绝伦，贴近现实，尺度之大，前所未有，从中可以一窥官场的现实版厚黑学！"
"陳小魚兒","5","我妈开着电视 我坐在沙发上做ppt 电视上在放着这个…第一集………那个反贪局什么的真的喜欢不来 完完全全勾起痛苦的回忆"
"蛋蛋壳","5","太好看了！主旋律电视剧还有这么好看的！"
"莫杞儿","2","拍得真好"
"你去哪了","0","有意思啊"
"百里","2","奉旨拍戏的尺度就是大！"
"Blue","4","喜欢达康书记"
"戚阿九","2","部分台词 强行洗脑 看着恶心"
"紫色","2","先给4星，其实我是想打5星的毕竟才播了10多集，不能太早下结论，这剧对于我们这种70后人来说，感受是比较真切的，70后的人混到现在多少也是经历些事故的，看清基本门道没问题，拍的确实好，且尺度在我看来算是20年前《黑冰》《黑洞》10年前《蜗居》后最大的反腐剧了，相当难得，等全剧终再来修改评价。"
"Alcibiades","0","拉踩的名义，营销的名义，带着你3000万的营销费滚吧，水军买的到处都是，拉踩的通稿铺天盖地，每天性骚扰我这样的普通网民。再好的剧，剧方心术不正，也一样垃圾。"
"立坤伯伯","0","至少6/7成还原官场百态，群演们那个眼神飘忽看起来就像低成本剧哈哈哈，7.8吧，但就凭这个史无前例的尺度应该多给分鼓励一下审查部门。回过头想想，我们大陆百姓吃糖毕竟还是太少，上面偶尔给我们一颗糖，大家都得开心得好几个月。"
"云裳","6","奔着侯勇老师和那一屋子钞票戏去的，开头紧张刺激，尺度这么大的国产官场反腐剧首部就是最大卖点和意义所在，看～"
"Sally","0","今天看了两集。题材严肃，剧情紧凑，间或搞笑，是一部很容易让人追下去的剧。演员演技普遍在线，尤其赵处和丁副市长两个反派，演得出神入化。男主如果再沧桑点、痞气点就好了。更新：可惜从第三集开始要拉进度条，第四集弃剧了。只想知道丁副市长最后的结局和谁是最后的大boss。等播完再打听吧！"
"弗里茨维尔","0","多大程度符合你对它的想象？"
"阿尔茫","0","第一集好看到不想睡觉，后面剧情拖拉，尤其是郑西坡父子，恶心的要死。所以给4分。"
"普罗米修斯","0","节奏太慢，煽情太多。还有几个角色智商下线，几个演员拖后腿！总体很不错！最受不了马桶台，瞎鸡巴乱剪！日你妈！"
"爱吃鱼的猫","14","尺度很大啊 都是老戏骨 没觉得陆毅演的不好 至少不出戏 慢慢磨呗 讨厌跟风黑的人 达康书记表情包出炉 达康书记别低头 GDP会掉 希望后面不要崩啊"
"狭雾凌","1","不容易啊…这么多年…个人觉得编剧的强项是公事政事表现力5星，私事生活事表现力3星。但是看到豆瓣中某些弱智逢中必反，逢共必反——这是病，得治。病因：1、养猪网上太多了。2、被另一种思维洗脑，一样的臭不可闻。所以为了反对这些水军，总体5星。"
"克里斯托福","0","侯亮平夫妇，林华华陆亦可，郑西坡父子，这三对每次出场都尴尬的要死，编剧对“吸引年轻人”有相当深的误解。"
"梅林","0","上联人民的名义，下联官场的权斗，其实剧中的人民依然失声，依然由几个高大全的包公脸谱人物来代表人民，从而树立起来的依然还是党员干部的先锋模范代表性，人民本身依然是人肉背景。不过，本片人物刻画和情节台词还是迈出一大步，即满足人群热关又迎合反腐精神，剧情有点拖沓。"
"Myra_米拉小姐","9","放在前几年我是万万看不进去这种一本正经的主旋律剧的 但是现在这个剧 竟然一口气看了五集 说明我是真的老了啊 也说明节奏把握不错 看到简介有五十几集 一身汗"
"没关系啊汪","7","感谢国产剧，可以和爸爸妈妈一起看！"
"凤凰","10","前五集看后，拍的确实大胆的很，有些台词和剧情真是很漏骨啊！像这样的正剧真心进步的很多啊……"
"Floria","0","曾也想在检察院工作呐，不过就是现在渐渐忘了自己曾经学过法律的事实。"
"外太空男神✨","1","距离就是豆瓣全民刷人民的名义而同学们讨论的却是因为遇见你"
"youngshy","1","值得我每晚追的剧，打四星，没毛病。"
"抱起我的小鲤鱼","16","从美剧路子的编排，到偶像主角，自带萌属性的达康书记，一望便知，这剧是拍给什么样的受众看的。00后或者60后会去豆瓣勾星还是会去关注评分？再联想到近几年的二次元党课，卖萌官微，就只有一句话可说了：党为了教育好80、90一干小娃娃，如此煞费苦心，娃娃们还有什么理由不好好工作？"
"小_小_小涵___高","14","看到陈岩石给大风厂的员工开会              电视不能拖进度条导致十分难受              必须来打个两星了   尴尬"
"wujy","24","龙生龙凤生凤，老鼠的孩子会打洞，这这部电视告诉我们的东西"
